Keyword,Text_Clean,Text_Segmented,Created_At
Thương mại,tổng thống trump cho biết ấn độ đã đề xuất một thỏa thuận thương mại với hoa kỳ nhằm xóa bỏ thuế quan đối với nhiều mặt hàng của mỹ,tổng_thống trump cho biết ấn_độ đã đề_xuất một thoả_thuận thương_mại với hoa_kỳ nhằm xoá_bỏ thuế_quan đối_với nhiều mặt_hàng của mỹ,2025-05-15 08:17:05+00:00
Thương mại,các nước nam toàn cầu đang đứng lên đấu tranh vì thương mại công bằng và sự phát triển trước thuế quan của hoa kỳ họ kêu gọi sự tôn trọng cho quyền sống còn của mình đồng thời xây dựng những liên minh mới để khám phá thị trườn,các nước nam toàn_cầu đang đứng lên đấu_tranh vì thương_mại công_bằng và sự phát_triển trước thuế_quan của hoa_kỳ họ kêu_gọi sự tôn_trọng cho quyền sống_còn của mình đồng_thời xây_dựng những liên_minh mới để khám_phá thị trườn,2025-05-15 08:07:17+00:00
Thương mại,bộ thương mại trung quốc về việc thiết lập cơ chế đàm phán thương mại với mỹ sẽ công bố thêm thông tin vào thời điểm thích hợp,bộ thương_mại trung_quốc về việc thiết_lập cơ_chế đàm_phán thương_mại với mỹ sẽ công_bố thêm thông_tin vào thời_điểm thích_hợp,2025-05-15 08:06:53+00:00
Thương mại,tổng thống mỹ trump cho biết ấn độ đã đề xuất một thỏa thuận thương mại với hoa kỳ nhằm xóa bỏ thuế quan đối với nhiều mặt hàng của mỹ,tổng_thống mỹ trump cho biết ấn_độ đã đề_xuất một thoả_thuận thương_mại với hoa_kỳ nhằm xoá_bỏ thuế_quan đối_với nhiều mặt_hàng của mỹ,2025-05-15 07:59:25+00:00
Thương mại,vậy mới cân bằng thương mại mà bộ ngoại ngoại vn nói lấy làm tiếc ôi vn lừa cả hk chứ dân vn là cái thứ bỏ đi,vậy mới cân_bằng thương_mại mà bộ ngoại ngoại vn nói lấy_làm tiếc ôi vn lừa cả hk chứ dân vn là cái thứ bỏ đi,2025-05-15 07:56:22+00:00
Thương mại,ủy viên thương mại eu šefčovič cho biết sẽ gặp bộ trưởng thương mại lutnick tại cuộc họp oecd cuộc họp hội đồng bộ trưởng oecd sẽ diễn ra từ ngày 3 đến 4 tháng 6 eu và mỹ đã đồng ý tăng cường liên lạc trong các cuộc đàm phán thương mại,uỷ_viên thương_mại eu šefčovič cho biết sẽ gặp bộ_trưởng thương_mại lutnick tại cuộc họp oecd cuộc họp hội_đồng_bộ_trưởng oecd sẽ diễn ra từ ngày 3 đến 4 tháng 6 eu và mỹ đã đồng_ý tăng_cường liên_lạc trong các cuộc đàm_phán thương_mại,2025-05-15 07:40:49+00:00
Thương mại,sefcovic của eu eu và mỹ đã đồng ý tăng cường liên lạc về đàm phán thương mại,sefcovic của eu eu và mỹ đã đồng_ý tăng_cường liên_lạc về đàm_phán thương_mại,2025-05-15 07:39:13+00:00
Thương mại,bộ trưởng thương mại hàn quốc đề nghị đại diện mexico nỗ lực hết sức để đạt được thỏa thuận thương mại với mỹ do nhiều doanh nghiệp hàn quốc đang hoạt động tại quốc gia này,bộ_trưởng thương_mại hàn_quốc đề_nghị đại_diện mexico nỗ_lực hết_sức để đạt được thoả_thuận thương_mại với mỹ do nhiều doanh_nghiệp hàn_quốc đang hoạt_động tại quốc_gia này,2025-05-15 07:34:28+00:00
Thương mại,bộ trưởng thương mại hàn quốc đề nghị người đồng cấp việt nam tích cực tìm kiếm đàm phán với mỹ,bộ_trưởng thương_mại hàn_quốc đề_nghị người đồng cấp việt_nam tích_cực tìm_kiếm đàm_phán với mỹ,2025-05-15 07:34:17+00:00
Thương mại,tiền tệ châu á tăng giá dẫn đầu là won hàn quốc đồng đô la mỹ suy yếu giữa bối cảnh bất ổn thương mạ,tiền_tệ châu_á tăng_giá dẫn_đầu là won hàn_quốc đồng đô_la mỹ suy_yếu giữa bối_cảnh bất_ổn thương mạ,2025-05-15 07:28:40+00:00
Thương mại,capital economics đánh giá tình hình thuế quan của mỹ trong bối cảnh căng thẳng thương mại hạ nhiệt,capital economics đánh_giá tình_hình thuế_quan của mỹ trong bối_cảnh căng_thẳng thương_mại hạ nhiệt,2025-05-15 07:26:55+00:00
Thương mại,trump bộ trưởng thương mại lutnick thích ý tưởng về quỹ đầu tư quốc gia thà trả nợ trước khi thành lập quỹ đầu tư quốc gia,trump bộ_trưởng thương_mại lutnick thích ý_tưởng về quỹ đầu_tư quốc_gia thà trả nợ trước khi thành_lập quỹ đầu_tư quốc_gia,2025-05-15 07:16:32+00:00
Thương mại,mỹ ngậm đắng nuốt cay khi brazil cướp thị phần dù căng thẳng thương mại tạm lắng nông dân mỹ thừa nhận brazil vẫn chiếm thị phần đậu nành trung quốc bài học mất thị trường rất khó lấy lại like nếu bạn ngạc nhiên brazil vietnam news,mỹ ngậm_đắng_nuốt_cay khi brazil cướp thị_phần dù căng_thẳng thương_mại tạm lắng nông_dân mỹ thừa_nhận brazil vẫn chiếm thị_phần đậu_nành trung_quốc bài_học mất thị_trường rất khó lấy lại like nếu bạn ngạc_nhiên brazil vietnam news,2025-05-15 07:15:44+00:00
Thương mại,nhật bản dự định thăm washington vào tuần tới cho vòng đàm phán thương mại thứ ba reuters,nhật_bản dự_định thăm washington vào tuần tới cho vòng đàm_phán thương_mại thứ ba reuters,2025-05-15 06:59:31+00:00
Thương mại,các nhà đàm phán thương mại hoa kỳ và trung quốc họp tại hàn quốc các quan chức cấp cao của mỹ và trung quốc bao gồm đại diện thương mại mỹ jamieson greer và đại diện trung quốc li chenggang đã gặp nhau tại jeju hàn quốc để thảo luận về các,các nhà đàm_phán thương_mại hoa_kỳ và trung_quốc họp tại hàn_quốc các quan_chức cấp cao của mỹ và trung_quốc bao_gồm đại_diện thương_mại mỹ jamieson greer và đại_diện trung_quốc li chenggang đã gặp nhau tại jeju hàn_quốc để thảo_luận về các,2025-05-15 06:53:18+00:00
Thương mại,thuế quan của trump ảnh hưởng đến ngành thương mại kim cương và trang sức trị giá 30 tỷ đô la của ấn độ thuế nhập khẩu mới do donald trump áp đặt có thể khiến xuất khẩu kim cương và trang sức của ấn độ sang mỹ giảm tới 50 dù các nhà xuất kh,thuế_quan của trump ảnh_hưởng đến ngành thương_mại kim_cương và trang_sức trị_giá 30 tỷ đô_la của ấn_độ thuế nhập_khẩu mới do donald trump áp_đặt có_thể khiến xuất_khẩu kim_cương và trang_sức của ấn_độ sang mỹ giảm tới 50 dù các nhà xuất kh,2025-05-15 06:45:19+00:00
Thương mại,giữa trung tâm thương mại lớn bậc nhất seoul họ chạy cái biển chào mừng hector chào mừng xong thì móc túi tôi kiểu này đây sau lúc chụp hình này số túi tăng cấp số nhân chứ không chỉ 2 túi này đâu,giữa trung_tâm thương_mại lớn bậc nhất seoul họ chạy cái biển chào_mừng hector chào_mừng xong thì móc_túi tôi kiểu này đây sau lúc chụp hình này số túi tăng cấp_số nhân chứ không_chỉ 2 túi này đâu,2025-05-15 06:43:10+00:00
Thương mại,giá vàng chạm đáy 1 tháng do tiến triển thương mại mỹtrung và tâm điểm dữ liệu kinh tế,giá vàng chạm đáy 1 tháng do tiến_triển thương_mại mỹtrung và tâm điểm dữ_liệu kinh_tế,2025-05-15 06:38:30+00:00
Thương mại,là một nền tảng blockchain phi tập trung trên base cho phép tạo đồng sở hữu và kiếm tiền từ các ai agent các ai này hoạt động trong game giải trí và thương mại được token hóa để tối đa hóa tiềm năng doanh thu nền,là một nền_tảng blockchain phi tập_trung trên base cho_phép tạo đồng sở_hữu và kiếm tiền từ các ai agent các ai này hoạt_động trong game giải_trí và thương_mại được token hoá để tối_đa_hoá tiềm_năng doanh_thu nền,2025-05-15 06:31:29+00:00
Thương mại,ducalnhờtraisụccặctrongtrungtâmthươngmạicựcdâm,ducalnhờtraisụccặctrongtrungtâmthươngmạicựcdâm,2025-05-15 05:42:58+00:00
Thương mại,xin chào anh có hứng thú với quảng cáo thương mại không,xin chào anh có hứng_thú với quảng_cáo thương_mại không,2025-05-15 05:08:05+00:00
Thương mại,bộ thương mại trung quốc ngày 145 cho biết trung quốc đã quyết định tạm dừng một số biện pháp phi thuế quan áp đặt đối với các thực thể mỹ nằm trong danh sách thực thể không đáng tin cậy và danh sách kiểm soát xuất khẩu,bộ thương_mại trung_quốc ngày 145 cho biết trung_quốc đã quyết_định tạm dừng một_số biện_pháp phi thuế_quan áp_đặt đối_với các thực_thể mỹ nằm trong danh_sách thực_thể không đáng tin_cậy và danh_sách kiểm_soát xuất_khẩu,2025-05-15 04:42:16+00:00
Thương mại,hiện nay các sàn thương mại điện tử hay các trang mạng xã hội là thị trường nóng hổi cho các hoạt động mmo mạng xã hội không chỉ là nơi chia sẻ kiến thức giải trí mà các hoạt động kiếm tiền online cũng được diễn mỗi ngày,hiện_nay các sàn thương_mại_điện_tử hay các trang mạng xã_hội là thị_trường nóng_hổi cho các hoạt_động mmo mạng xã_hội không_chỉ là nơi chia_sẻ kiến_thức giải_trí mà các hoạt_động kiếm tiền online cũng được diễn mỗi ngày,2025-05-15 04:41:06+00:00
Thương mại,kinh tế của việt nam có thể tạo ra nhiều cơ hội hợp tác mới với trung quốc đặc biệt trong lĩnh vực thương mại và đầu tư tuy nhiên cũng có những lo ngại về khả năng cạnh tranh giữa hai nền kinh tế quan trọng nhất là việc cả hai bên,kinh_tế của việt_nam có_thể tạo ra nhiều cơ_hội hợp_tác mới với trung_quốc đặc_biệt trong lĩnh_vực thương_mại và đầu_tư tuy_nhiên cũng có những lo_ngại về khả_năng cạnh_tranh giữa hai nền kinh_tế quan_trọng nhất là việc cả hai bên,2025-05-15 04:28:25+00:00
Thương mại,trung quốc đang nắm con át chủ bài trong cuộc chiến thương mại với mỹ xem chi tiết tại goldenfund tiente gocnhintaichinh dautuvang dautu mytrung cttm,trung_quốc đang nắm con át_chủ_bài trong cuộc_chiến thương_mại với mỹ xem chi_tiết tại goldenfund tiente gocnhintaichinh dautuvang dautu mytrung cttm,2025-05-15 04:11:44+00:00
Thương mại,quốc hội việt nam ngày 135 đã thảo luận đề xuất thành lập khu thương mại tự do tại hải phòng để thúc đẩy tăng trưởng kinh tế đề xuất này cũng nhằm củng cố vai trò của hải phòng như một động lực phát triển chính ở khu vực đồng bằng sông hồng,quốc_hội việt_nam ngày 135 đã thảo_luận đề_xuất thành_lập khu thương_mại tự_do tại hải_phòng để thúc_đẩy tăng_trưởng kinh_tế đề_xuất này cũng nhằm củng_cố vai_trò của hải_phòng như một động_lực phát_triển chính ở khu_vực đồng_bằng sông hồng,2025-05-15 04:06:25+00:00
Thương mại,đọc comment thấy nhiều bác bi quan và tiêu cực quá cá nhân mình thấy thế này bài hơi dài mình thấy khá giống chuyện đã xảy ra với ngành thương mại điện tử mình đã làm nhiều năm trước đây thì không có quy định về thuế nhưng sau đó có quy định thì sẽ cần,đọc comment thấy nhiều bác bi_quan và tiêu_cực quá cá_nhân mình thấy thế_này bài hơi dài mình thấy khá giống chuyện đã xảy ra với ngành thương_mại_điện_tử mình đã làm nhiều năm trước_đây thì không có quy_định về thuế nhưng sau đó có quy_định thì sẽ cần,2025-05-15 04:03:49+00:00
Thương mại,shophouse phố hiến city là khu nhà phố thương mại cao cấp tọa lạc tại xã dân tiến huyện khoái châu tỉnh hưng yên sở hữu vị trí chiến lược trên trục đường nguyễn trãi rộng 60m dự án mang đến không,shophouse phố hiến city là khu nhà phố thương_mại cao_cấp toạ_lạc tại xã dân_tiến huyện khoái_châu tỉnh hưng_yên sở_hữu vị_trí chiến_lược trên trục đường nguyễn_trãi rộng 60m dự_án mang đến không,2025-05-15 04:02:50+00:00
Thương mại,eu bị mỹ ép chốt kèo thương mại trong 90 ngày mỹ dọa áp thuế 25 lên hàng loạt mặt hàng eu căng như dây đàn nguy cơ chiến tranh thương mại xuyên đại tây dương maxmarketinsider wisematch mmi xuhuong tradewar euvsus trumptrade,eu bị mỹ ép chốt kèo thương_mại trong 90 ngày mỹ doạ áp_thuế 25 lên hàng_loạt mặt_hàng eu căng như dây đàn nguy_cơ chiến_tranh thương_mại xuyên đại tây dương maxmarketinsider wisematch mmi xuhuong tradewar euvsus trumptrade,2025-05-15 03:51:01+00:00
Thương mại,pifest nền tảng thương mạigiao dịchdịch vụhàng hóa bên ngoài đời sống hệ sinh thái pinetwork cộng đồng pi network ở các quốc gia trên thế giới sử dụng đồng pi π để chi tiêu mua bán các loại mặt hàngsản phẩmđồ dùng và ăn uống trong cuộc sống,pifest nền_tảng thương mạigiao dịchdịch vụhàng hoá bên ngoài đời_sống hệ_sinh_thái pinetwork cộng_đồng pi network ở các quốc_gia trên thế_giới sử_dụng đồng pi π để chi_tiêu mua_bán các loại mặt hàngsản phẩmđồ dùng và ăn_uống trong cuộc_sống,2025-05-15 03:38:36+00:00
Thương mại,rất mong đợi dapp thương mại điện tử,rất mong_đợi dapp thương_mại_điện_tử,2025-05-15 03:32:30+00:00
Thương mại,hạc tiếng anh thương mại cùng và thầy giáo,hạc tiếng anh thương_mại cùng và thầy_giáo,2025-05-15 03:27:42+00:00
Thương mại,china luôn ăn cắp công nghệ của các nuóc tiên tiến nhg sản xuất ra thì ko bằnggiờ chính sách của trump nhằm tiêu diệt gian lận thuong mại cua china thoigiờ china phải trả giá thôiráng chịu đitrở lai thòi điểm nhh năm 70 là được rồi,china luôn ăn_cắp công_nghệ của các nuóc tiên_tiến nhg sản_xuất ra thì ko bằnggiờ chính_sách của trump nhằm tiêu_diệt gian_lận thuong mại cua china thoigiờ china phải trả_giá thôiráng chịu đitrở lai thòi điểm nhh năm 70 là được rồi,2025-05-15 03:25:05+00:00
Thương mại,ngocgiaphat sàn thương mại điện tử,ngocgiaphat sàn thương_mại_điện_tử,2025-05-15 03:16:27+00:00
Thương mại,một phát hiện rất tinh tế của anh lý xuân hải 1 ít người để ý trong thoả thuận thương mại mỹ anh ngoài các điều khoản thương mại thông thường về mức thuế và yêu cầu về an toàn cho ngành công nghiệp thép dược phẩm và giảm thuế quan của mỹ với ô,một phát_hiện rất tinh_tế của anh lý xuân hải 1 ít người để_ý trong thoả_thuận thương_mại mỹ anh ngoài các điều_khoản thương_mại thông_thường về mức thuế và yêu_cầu về an_toàn cho ngành công_nghiệp thép dược_phẩm và giảm thuế_quan của mỹ với ô,2025-05-15 03:05:09+00:00
Thương mại,chủ tịch tập cận bình đã phản hồi thư của simon lichtenberg ceo phòng thương mại đan mạch tại trung quốc nhấn mạnh tầm quan trọng của đối thoại cởi mở với doanh nhân quốc tế đây là cơ hội để củng cố mối quan hệ và tạo nền,chủ_tịch tập_cận_bình đã phản_hồi thư của simon lichtenberg ceo phòng thương_mại đan_mạch tại trung_quốc nhấn_mạnh tầm quan_trọng của đối_thoại cởi_mở với doanh_nhân quốc_tế đây là cơ_hội để củng_cố mối quan_hệ và tạo nền,2025-05-15 02:30:21+00:00
Thương mại,thương mại toàn cầu vẫn trong tình trạng khủng hoảng mặc dù cuộc chiến thuế quan giữa hai nền kinh tế đã dịu đi gần đây,thương_mại toàn_cầu vẫn trong tình_trạng khủng_hoảng mặc_dù cuộc_chiến thuế_quan giữa hai nền kinh_tế đã dịu đi gần đây,2025-05-15 02:26:03+00:00
Thương mại,tổng giám đốc wto cảnh báo các thỏa thuận thuế quan song phương của hoa kỳ có thể gây nguy hiểm cho nguyên tắc thương mại,tổng_giám_đốc wto cảnh_báo các thoả_thuận thuế_quan song_phương của hoa_kỳ có_thể gây nguy_hiểm cho nguyên_tắc thương_mại,2025-05-15 02:25:46+00:00
Chính trị,này bọn nó làm content kiếm tiền twitter bác có cha còn viết bài hướng dẫn kiếm tiền từ chính trị nữa mà,này bọn nó làm content kiếm tiền twitter bác có cha còn viết bài hướng_dẫn kiếm tiền từ chính_trị nữa mà,2025-05-15 08:40:30+00:00
Chính trị,trong 3 tháng trở lại đây thì tin tức tốt cho thị trường crypto rất nhiều nhưng có vẻ tỉ suất lợi nhuận vẫn chưa làm hài lòng nhà đầu tư phần lớn là ảnh hưởng từ vĩ mô chính trị hay là của trump nhưng anh em yên tâm đến khi những tin tức như,trong 3 tháng trở_lại đây thì tin_tức tốt cho thị_trường crypto rất nhiều nhưng có_vẻ tỉ_suất lợi_nhuận vẫn chưa làm hài_lòng nhà_đầu_tư phần_lớn là ảnh_hưởng từ vĩ_mô chính_trị hay là của trump nhưng anh_em yên_tâm đến khi những tin_tức như,2025-05-15 08:40:28+00:00
Chính trị,bức tranh lạm phát tại mỹ trong tháng 42025 đang cho thấy những tín hiệu dịu lại so với các tháng trước song vẫn ẩn chứa nhiều bất định do các yếu tố địa chính trị và chính sách thuế quan khó đoán định,bức tranh lạm_phát tại mỹ trong tháng 42025 đang cho thấy những tín_hiệu dịu lại so với các tháng trước song vẫn ẩn_chứa nhiều bất_định do các yếu_tố địa_chính_trị và chính_sách thuế_quan khó đoán_định,2025-05-15 08:24:02+00:00
Chính trị,chuyên tổ chức bình luận chính trị chê tổng thống donal trump không xứng đáng tư cách là 1 đàn ông,chuyên tổ_chức bình_luận chính_trị chê tổng_thống donal trump không xứng_đáng tư_cách là 1 đàn_ông,2025-05-15 08:01:52+00:00
Chính trị,trump tôi nghĩ chúng ta đang rất gần đạt được một thỏa thuận với iran chỉ mới hôm qua ông ấy còn đe dọa sẽ áp dụng áp lực tối đa lên iran với chuyến thăm trung đông trump đang chuyển sự chú ý sang các vấn đề địa chính trị khác trong tuần này tu,trump tôi nghĩ chúng_ta đang rất gần đạt được một thoả_thuận với iran chỉ mới hôm_qua ông ấy còn đe_doạ sẽ áp_dụng áp_lực tối_đa lên iran với chuyến thăm trung đông trump đang chuyển sự chú_ý sang các vấn_đề địa_chính_trị khác trong tuần này tu,2025-05-15 07:01:10+00:00
Chính trị,bình giữ nhiệt in logo lớp lý luận chính trị khóa xxx quatangdoanhnghiep,bình giữ nhiệt in logo lớp lý_luận chính_trị khoá xxx quatangdoanhnghiep,2025-05-15 06:59:49+00:00
Chính trị,cô ta chẳng có gì nói chỉ nhai đi nhai lại những thứ vớ vẩn tin giả nước mỹ có quá nhiều việc để chung tay chung sức cho các chính trị gia làm chứ đâu phải ngồi đó nhậu riết cái thứ vớ vẩn như vậy,cô ta chẳng có gì nói chỉ nhai đi nhai_lại những thứ vớ_vẩn tin giả nước mỹ có quá nhiều việc để chung tay chung sức cho các chính_trị_gia làm chứ đâu phải ngồi đó nhậu riết cái thứ vớ_vẩn như_vậy,2025-05-15 05:42:16+00:00
Chính trị,1 larry fink là ai larry fink sinh năm 1952 tại california trong một gia đình trung lưu bố ông làm chủ tiệm giày nhỏ mẹ là giáo viên ông theo học ngành khoa học chính trị rồi lấy bằng mba chuyên ngành bất động sản tại ucla ban đầu fink định hướng,1 larry fink là ai larry fink sinh năm 1952 tại california trong một gia_đình trung_lưu bố ông làm chủ tiệm giày nhỏ mẹ là giáo_viên ông theo học ngành khoa_học chính_trị rồi lấy bằng mba chuyên_ngành bất_động_sản tại ucla ban_đầu fink định_hướng,2025-05-15 04:54:29+00:00
Chính trị,nguyễn duy ngọc thái giám giữ ấn của triều đình họ tô trầm lặng trung thành và tuyệt đối nguy hiểmlà kiến trúc sư ngầm cho các chiến dịch dọn đường chính trị ông được coi là quân cờ chiến lược anh rừng chọn để kế nhiệm ghế bộ trưởng công an,nguyễn_duy ngọc thái_giám giữ ấn của triều_đình họ tô trầm_lặng trung_thành và tuyệt_đối nguy hiểmlà kiến_trúc_sư ngầm cho các chiến_dịch dọn đường chính_trị ông được coi là quân cờ chiến_lược anh rừng chọn để kế_nhiệm ghế bộ_trưởng công_an,2025-05-15 04:41:32+00:00
Chính trị,đầu 2025 trước 12 ngày trump lên nhậm chức đó bro đợt đó sóng meme chính trị gia mà,đầu 2025 trước 12 ngày trump lên nhậm_chức đó bro đợt đó sóng meme chính_trị_gia mà,2025-05-15 04:34:49+00:00
Chính trị,2xấu hổ khác hôm nay đảng cộng hòa tại hạ viện sẽ nhanh chóng hành động để loại bỏ nó trong khi đảng dân chủ đang nổi cơn thịnh nộ cản trở việc thực thi pháp luật chơi trò chơi chính trị và chứng minh họ lạc hậu đến mức nào đảng cộng hòa,2xấu hổ khác hôm_nay đảng cộng_hoà tại hạ_viện sẽ nhanh_chóng hành_động để loại_bỏ nó trong khi đảng dân_chủ đang nổi cơn thịnh_nộ cản_trở việc thực_thi pháp_luật chơi trò_chơi chính_trị và chứng_minh họ lạc_hậu đến mức nào đảng cộng_hoà,2025-05-15 04:29:45+00:00
Chính trị,1đảng dân chủ tại hạ viện đã một lần nữa chứng minh rằng họ sẵn sàng lạm dụng hiến pháp trong nỗ lực cản trở chương trình nghị sự của người dân mỹ trò hề luận tội giả mạo mới nhất của họ đối với tổng thống trump là một trò chính trị đáng,1đảng dân_chủ tại hạ_viện đã một lần nữa chứng_minh rằng họ sẵn_sàng lạm_dụng hiến_pháp trong nỗ_lực cản_trở chương_trình_nghị_sự của người_dân mỹ trò_hề luận_tội giả_mạo mới nhất của họ đối_với tổng_thống trump là một trò chính_trị đáng,2025-05-15 04:29:44+00:00
Chính trị,mối quan hệ giữa trung quốc và việt nam luôn là chủ đề nóng hổi trong giới quan sát chính trị mới đây sự phát triển kinh tế của việt nam đang được xem xét tác động như thế nào đến quan hệ hai nước theo các chuyên gia tăng trưởng,mối quan_hệ giữa trung_quốc và việt_nam luôn là chủ_đề nóng_hổi trong giới quan_sát chính_trị mới_đây sự phát_triển kinh_tế của việt_nam đang được xem_xét tác_động như_thế_nào đến quan_hệ hai nước theo các chuyên_gia tăng_trưởng,2025-05-15 04:28:24+00:00
Chính trị,crypto refback news đảng dân chủ gây áp lực về việc điều tra tổng thống trump nghi vấn trục lợi chính trị từ crypto mới đây hàng loạt nghị sĩ đảng dân chủ yêu cầu điều tra tổng thống donald trump vì nghi ngờ lợi dụng quyền lực để trục lợi,crypto refback news đảng dân_chủ gây áp_lực về việc điều_tra tổng_thống trump nghi_vấn trục_lợi chính_trị từ crypto mới_đây hàng_loạt nghị_sĩ đảng dân_chủ yêu_cầu điều_tra tổng_thống donald trump vì nghi_ngờ lợi_dụng quyền_lực để trục_lợi,2025-05-15 04:27:40+00:00
Chính trị,nếu nhìn ở gốc độ truyền thông sẽ ko thấy như nhìn ở góc độ chính trị chiến tranh thuế quan kết liễu thuế cải cách bộ máy cai trị sụp đổ chính trị dùng kiến thức và tư duy đi,nếu nhìn ở gốc độ truyền_thông sẽ ko thấy như nhìn ở góc_độ chính_trị chiến_tranh thuế_quan kết_liễu thuế cải_cách bộ_máy cai_trị sụp_đổ chính_trị dùng kiến_thức và tư_duy_đi,2025-05-15 04:21:28+00:00
