Keyword,Text_Clean,Text_Segmented,Created_At
Công nghệ,website rất sáng tạo tạo nên một phong cách độc đáo trong thế giới công nghệ,website rất sáng_tạo tạo nên một phong_cách độc_đáo trong thế_giới công_nghệ,2025-05-15 08:03:44+00:00
Công nghệ,phần mềm quản lý nhân sự hrm công ty giải pháp công nghệ cak solution all in one phần mềm quản lý nhân sự hrm giải pháp tối ưu hóa nguồn nhân lực cho doanh nghiệp,phần_mềm quản_lý nhân_sự hrm công_ty giải_pháp công_nghệ cak solution all in one phần_mềm quản_lý nhân_sự hrm giải_pháp tối_ưu_hoá nguồn nhân_lực cho doanh_nghiệp,2025-05-15 08:03:30+00:00
Công nghệ,wow dự án này thật sự khiến tôi bất ngờ và hào hứng chắc chắn sẽ là game changer trong ngành công nghệ,wow dự_án này thật_sự khiến tôi bất_ngờ và hào_hứng chắc_chắn sẽ là game changer trong ngành công_nghệ,2025-05-15 08:01:57+00:00
Công nghệ,bản thân vin cũng không có công nghệ chỉ đại diện nhà nước đi shopping công nghệ về nội địa hóa thôi chủ yếu hỗ trợ vin bằng cho vay vốn dài hạn và ưu tiên các công trình bds chung quanh các ga,bản_thân vin cũng không có công_nghệ chỉ đại_diện nhà_nước đi shopping công_nghệ về nội_địa_hoá thôi chủ_yếu hỗ_trợ vin bằng cho vay vốn dài_hạn và ưu_tiên các công_trình bds chung_quanh các ga,2025-05-15 08:00:54+00:00
Công nghệ,công nghệ xử lý ảo thật,công_nghệ xử_lý ảo thật,2025-05-15 08:00:49+00:00
Công nghệ,niêm yết mới trên bingx đây ae privasea ai prai là dự án kết hợp ai amp bảo mật dữ liệu bằng công nghệ fhe hiện đại giải pháp cho bài toán quyền riêng tư khi xử lý dữ liệu ai prai là token gốc dùng trong hệ sinh thái gồm deepsea network amp,niêm_yết mới trên bingx đây ae privasea ai prai là dự_án kết_hợp ai amp bảo_mật dữ_liệu bằng công_nghệ fhe hiện_đại giải_pháp cho bài_toán quyền riêng_tư khi xử_lý dữ_liệu ai prai là token gốc dùng trong hệ_sinh_thái gồm deepsea network amp,2025-05-15 08:00:03+00:00
Công nghệ,mua toàn bộ công nghệ bảo trì cũng kha khá đấy nhưng 20252030 tui tin vn sẽ làm đc,mua toàn_bộ công_nghệ bảo_trì cũng kha_khá đấy nhưng 20252030 tui tin vn sẽ làm đc,2025-05-15 07:58:26+00:00
Công nghệ,ika có thể đáng trông đợi với ưu điểm về vốn gọi và công nghệ độc đáo,ika có_thể đáng trông_đợi với ưu_điểm về vốn gọi và công_nghệ độc_đáo,2025-05-15 07:57:44+00:00
Công nghệ,hi ae cộng đồng hf ae k cần phải mỏi tay để vọc vạch đâu đôi mắt hãy để nó xem phim và việc còn lại để cho công nghệ hỗ trợ hehe ra là giật tê tái luôn nha mấy ae ib em oder cho nha bao xịn bao chính hãng,hi ae cộng_đồng hf ae k cần phải mỏi tay để vọc_vạch đâu đôi mắt hãy để nó xem phim và việc còn lại để cho công_nghệ hỗ_trợ hehe ra là giật tê_tái luôn nha mấy ae ib em oder cho nha bao xịn bao chính hãng,2025-05-15 07:56:54+00:00
Chuyển đổi số,kế hoạch triển khai phong trào cả nước thi đua đổi mới sáng tạo và chuyển đổi số,kế_hoạch triển_khai phong_trào cả nước thi_đua đổi_mới sáng_tạo và chuyển_đổi số,2025-05-15 05:39:30+00:00
Chuyển đổi số,trong thời đại chuyển đổi số phần mềm không chỉ là một công cụ hỗ trợ mà còn là một phần không thể thiếu trong vận hành quán cafe,trong thời_đại chuyển_đổi số phần_mềm không_chỉ là một công_cụ hỗ_trợ mà_còn là một phần không_thể thiếu trong vận_hành quán cafe,2025-05-14 14:18:44+00:00
Chuyển đổi số,chuyển đổi số là quá trình ứng dụng công nghệ để thay đổi cách vận hành quản lý và phục vụ khách hàng một cách hiệu quả hơn,chuyển_đổi số là quá_trình ứng_dụng công_nghệ để thay_đổi cách vận_hành quản_lý và phục_vụ khách_hàng một_cách hiệu_quả hơn,2025-05-14 13:56:57+00:00
Chuyển đổi số,recap lễ khánh thành thư viện chuyển đổi số mãi mãi một niềm tin dự án ươm mầm tri thức gieo hạt tương lai vẫn sẽ tiếp tục vững bước trên hành trình mở ra cánh cửa tri thức số cho thế hệ trẻ bwfventures bwf thuvienchuyendoiso uommamtrithuc,recap lễ khánh_thành thư_viện chuyển_đổi số mãi_mãi một niềm tin dự_án ươm mầm tri_thức gieo hạt tương_lai vẫn sẽ tiếp_tục vững bước trên hành_trình mở ra cánh cửa tri_thức số cho thế_hệ trẻ bwfventures bwf thuvienchuyendoiso uommamtrithuc,2025-05-14 13:43:32+00:00
Chuyển đổi số,chuyển đổi số trong cải cách thủ tục hành chính bài 2 hướng tới dịch vụ công phi địa giới,chuyển_đổi số trong cải_cách thủ_tục hành_chính bài 2 hướng tới dịch_vụ công phi địa_giới,2025-05-14 12:35:15+00:00
Chuyển đổi số,ngày 1352025 vnpt cloud đã được bộ khoa học và công nghệ công nhận là sản phẩm giải pháp tiêu biểu trong lĩnh vực khoa học công nghệ đổi mới sáng tạo và chuyển đổi số theo nghị quyết số 57nqtw vnptcloud makeinvietnam vietnam vnpt,ngày 1352025 vnpt cloud đã được bộ khoa_học và công_nghệ công_nhận là sản_phẩm giải_pháp tiêu_biểu trong lĩnh_vực khoa_học công_nghệ đổi_mới sáng_tạo và chuyển_đổi số theo nghị_quyết số 57nqtw vnptcloud makeinvietnam vietnam vnpt,2025-05-14 11:20:06+00:00
Chuyển đổi số,chuyển đổi số không còn là xu hướng nữa nó là yêu cầu tất yếu nếu bạn vẫn đang quản lý quán cà phê bằng giấy bút có lẽ đã đến lúc để thay đổi,chuyển_đổi số không còn là xu_hướng nữa nó là yêu_cầu tất_yếu nếu bạn vẫn đang quản_lý quán cà_phê bằng giấy bút có_lẽ đã đến lúc để thay_đổi,2025-05-14 08:15:21+00:00
Chuyển đổi số,we need supportive measures trợ để các doanh nghiệp chuyển đổi số اللحاق بالاتجاه التنمية في العالم,we need supportive measures trợ để các doanh_nghiệp chuyển_đổi số اللحاق_بالاتجاه_التنمية_في العالم,2025-05-14 08:06:32+00:00
Chuyển đổi số,các dự án mới trên thị trường thường tập trung vào công nghệ xanh chuyển đổi số và cải tiến quy trình sản xuất những lĩnh vực này hứa hẹn sẽ mang lại nhiều cơ hội phát triển bền vững,các dự_án mới trên thị_trường thường tập_trung vào công_nghệ_xanh chuyển_đổi số và cải_tiến quy_trình sản_xuất những lĩnh_vực này hứa_hẹn sẽ mang lại nhiều cơ_hội phát_triển bền_vững,2025-05-14 05:09:51+00:00
Chuyển đổi số,trong thời đại chuyển đổi số hóa đơn điện tử đã trở thành công cụ không thể thiếu đối với các doanh nghiệp và kế toán viên tuy nhiên không phải lúc nào hóa đơn điện tử cũng được lập đúng ngay từ đầu,trong thời_đại chuyển_đổi số_hoá đơn điện_tử đã trở_thành công_cụ không_thể thiếu đối_với các doanh_nghiệp và kế_toán_viên tuy_nhiên không phải lúc_nào hoá_đơn điện_tử cũng được lập đúng ngay từ đầu,2025-05-14 02:03:47+00:00
Chuyển đổi số,chỉ vài tháng nữa fpt sẽ ký kết hợp tác với 300 tập đoàn hàng đầu thế giới về chuyển đổi số và ai ông vũ anh tú giám đốc công nghệ tập đoàn fpt fpt cho rằng đà nẵng đang có nhiều lợi thế về địa lý và nguồn nhân lực công nghệ fpt dự kiến sẽ,chỉ vài tháng nữa fpt sẽ ký_kết hợp_tác với 300 tập_đoàn hàng_đầu thế_giới về chuyển_đổi số và ai ông vũ anh tú giám_đốc công_nghệ tập_đoàn fpt fpt cho rằng đà_nẵng đang có nhiều lợi_thế về địa_lý và nguồn nhân_lực công_nghệ fpt dự_kiến sẽ,2025-05-13 14:09:47+00:00
Chuyển đổi số,bế mạc lễ khánh thành thư viện chuyển đổi số năm 2025 vào chiều ngày 12052025 bwf ventures đã tổ chức thành công lễ khánh thành dự án thư viện chuyển đổi số tại trường tiểu học vĩnh hy sự kiện đánh dấu một cột mốc quan trọng trong hành trình mang,bế_mạc lễ khánh_thành thư_viện chuyển_đổi số năm 2025 vào chiều ngày 12052025 bwf ventures đã tổ_chức thành_công lễ khánh_thành dự_án thư_viện chuyển_đổi số tại trường tiểu_học vĩnh hy sự_kiện đánh_dấu một cột mốc quan_trọng trong hành_trình mang,2025-05-13 11:00:01+00:00
Chuyển đổi số,lợi ích khi sử dụng dịch vụ seo cho doanh nghiệp trong thời đại chuyển đổi số seo search engine optimization không chỉ là một chiến lược marketing mà còn là yếu lvgb2hyskw,lợi_ích khi sử_dụng dịch_vụ seo cho doanh_nghiệp trong thời_đại chuyển_đổi số seo search engine optimization không_chỉ là một chiến_lược marketing mà_còn là yếu lvgb2hyskw,2025-05-13 10:33:52+00:00
Chuyển đổi số,khoảnh khắc đặc biệt nhất buổi lễ khánh thành thư viện chuyển đổi số đánh dấu bước chân đầu tiên trong hành trình ươm mầm tri thức gieo hạt tương lai bwfventures bwf thuvienchuyendoiso uommamtrithuc gieohattuonglai ktpglobal nguyenvustore teknix csr,khoảnh_khắc đặc_biệt nhất buổi lễ khánh_thành thư_viện chuyển_đổi số đánh_dấu bước chân đầu_tiên trong hành_trình ươm mầm tri_thức gieo hạt tương_lai bwfventures bwf thuvienchuyendoiso uommamtrithuc gieohattuonglai ktpglobal nguyenvustore teknix csr,2025-05-13 09:00:02+00:00
Chuyển đổi số,attn token là dự án mới giúp cung cấp sự chuyển đổi số lớn cho người dùng mang lại nhiều cơ hội cho việc trao đổi và giao dịch công bằng tab giúp tăng sự minh bạch và công bằng cho cộng đồng người dùng,attn token là dự_án mới giúp cung_cấp sự chuyển_đổi số lớn cho người dùng mang lại nhiều cơ_hội cho việc trao_đổi và giao_dịch công_bằng tab giúp tăng sự minh_bạch và công_bằng cho cộng_đồng người dùng,2025-05-12 23:17:47+00:00
Chuyển đổi số,khai mạc lễ khánh thành thư viện chuyển đổi số 15h00 ngày 12052025 lễ khánh thành dự án thư viện chuyển đổi số được tổ chức bởi bwf ventures đã chính thức khai mạc buổi lễ vinh dự có sự hiện diện của các quý đại diện ubnd tỉnh ninh thuận các đơn,khai_mạc lễ khánh_thành thư_viện chuyển_đổi số 15h00 ngày 12052025 lễ khánh_thành dự_án thư_viện chuyển_đổi số được tổ_chức bởi bwf ventures đã chính_thức khai_mạc buổi lễ vinh_dự có sự hiện_diện của các quý đại_diện ubnd tỉnh ninh_thuận các đơn,2025-05-12 11:27:07+00:00
Chuyển đổi số,dự án trên mạng sui blockchain giúp đẩy mạnh sự phát triển và chuyển đổi số của cộng đồng cung cấp nền tảng cho các ứng dụng phi tập trung và các dịch vụ trao đổi tài sản trên blockchain,dự_án trên mạng sui blockchain giúp đẩy_mạnh sự phát_triển và chuyển_đổi số của cộng_đồng cung_cấp nền_tảng cho các ứng_dụng phi tập_trung và các dịch_vụ trao_đổi tài_sản trên blockchain,2025-05-12 10:30:00+00:00
Chuyển đổi số,listen to tổng quan và định hướng chuyển đổi số việt nam đến năm 2030 by vdi giải pháp tích hợp hệ thống chuyển đổi số chuyendoiso vdi xuhuớng,listen to tổng_quan và định_hướng chuyển_đổi số việt_nam đến năm 2030 by vdi giải_pháp tích_hợp hệ_thống chuyển_đổi số chuyendoiso vdi xuhuớng,2025-05-12 08:52:25+00:00
Chuyển đổi số,chương trình đào tạo bình dân học vụ số chủ đề phụ nữ thời đại số nâng tầm vai trò cán bộ hội qua chuyển đổi số cán bộ hội phụ nữ tỉnh hưng yên ngày 13052025,chương_trình đào_tạo bình_dân_học_vụ số chủ_đề phụ_nữ thời_đại số nâng tầm vai_trò cán_bộ hội qua chuyển_đổi số cán_bộ hội phụ_nữ tỉnh hưng_yên ngày 13052025,2025-05-12 08:46:46+00:00
Chuyển đổi số,enhancing transparency in construction investment through bim a strategic direction in the digital transformation era công khai hoạt động đầu tư xây dựng qua mô hình bim hướng đi tất yếu trong thời đại chuyển đổi số,enhancing transparency in construction investment through bim a strategic direction in the digital transformation era công_khai hoạt_động đầu_tư xây_dựng qua mô_hình bim hướng đi tất_yếu trong thời_đại chuyển_đổi số,2025-05-12 08:46:02+00:00
Chuyển đổi số,cập nhật trước giờ g thời khắc chúng ta luôn mong chờ đã đến bwf ventures đã có mặt tại vĩnh hy để chuẩn bị công tác tổ chức lễ khánh thành thư viện chuyển đổi số chiều nay cùng chờ đón những cập nhật mới nhất từ chúng tôi nhé bwfventures bwf,cập_nhật trước giờ g thời_khắc chúng_ta luôn mong_chờ đã đến bwf ventures đã có_mặt tại vĩnh hy để chuẩn_bị công_tác tổ_chức lễ khánh_thành thư_viện chuyển_đổi số chiều nay cùng chờ đón những cập_nhật mới nhất từ chúng_tôi nhé bwfventures bwf,2025-05-12 05:04:33+00:00
Chuyển đổi số,thách thức khi triển khai chuyển đổi số trong doanh nghiệp,thách_thức khi triển_khai chuyển_đổi số trong doanh_nghiệp,2025-05-11 12:51:13+00:00
Chuyển đổi số,inauguration of the digital transformation center in hydraulic engineering khai trương trung tâm chuyển đổi số trong kỹ thuật công trình thủy lợi,inauguration of the digital transformation center in hydraulic engineering khai_trương trung_tâm chuyển_đổi số trong kỹ_thuật công_trình thuỷ_lợi,2025-05-10 02:51:57+00:00
Chuyển đổi số,portcoast and huce cohost seminar on digital transformation for railway infrastructure portcoast và trường đại học xây dựng hà nội đồng tổ chức hội thảo chuyển đổi số cho hạ tầng đường sắt via,portcoast and huce cohost seminar on digital transformation for railway infrastructure portcoast và trường đại_học xây_dựng hà_nội đồng tổ_chức hội_thảo chuyển_đổi số cho hạ_tầng đường_sắt via,2025-05-10 02:31:33+00:00
Chuyển đổi số,portcoast presents digital solutions to support smart transportation development in da nang portcoast giới thiệu giải pháp chuyển đổi số hỗ trợ phát triển hệ thống giao thông thông minh tại đà nẵng,portcoast presents digital solutions to support smart transportation development in da nang portcoast giới_thiệu giải_pháp chuyển_đổi số hỗ_trợ phát_triển hệ_thống giao_thông thông_minh tại đà_nẵng,2025-05-10 02:13:45+00:00
Chuyển đổi số,portcoast drives digital transformation at hoa phat steel plant dung quat towards smart and sustainable industry portcoast thúc đẩy chuyển đổi số tại nhà máy thép hòa phát dung quất hướng tới công nghiệp thông minh và bền vững,portcoast drives digital transformation at hoa phat steel plant dung quat towards smart and sustainable industry portcoast thúc_đẩy chuyển_đổi số tại nhà_máy thép hoà phát dung quất hướng tới công_nghiệp thông_minh và bền_vững,2025-05-10 02:10:43+00:00
Chuyển đổi số,khánh thành thư viện chuyển đổi số tại ninh thuận dự án ươm mầm tri thức gieo hạt tương lai ngày 12052025 tại trường tiểu học vĩnh hy ninh hải ninh thuận bwf ventures phối hợp cùng ktp global chính thức tổ chức lễ khánh thành thư viện chuyển,khánh_thành thư_viện chuyển_đổi số tại ninh_thuận dự_án ươm mầm tri_thức gieo hạt tương_lai ngày 12052025 tại trường tiểu_học vĩnh hy ninh_hải ninh_thuận bwf ventures phối_hợp cùng ktp global chính_thức tổ_chức lễ khánh_thành thư_viện chuyển,2025-05-09 08:11:26+00:00
Chuyển đổi số,con trai ông trump cảnh báo các ngân hàng không chuyển đổi số sẽ bị tuyệt chủng và hôm nay 9 ngân hàng chi 33 nghìn tỷ vnđ bằng tiền mặt để trả cổ tức rõ ràng bọn ngân hàng đã nhìn thấy tương lai không mấy sáng sủa trước mắt nói là đen tối cũng được,con trai ông trump cảnh_báo các ngân_hàng không chuyển_đổi số sẽ bị tuyệt_chủng và hôm_nay 9 ngân_hàng chi 33 nghìn tỷ vnđ bằng tiền_mặt để trả cổ_tức rõ_ràng bọn ngân_hàng đã nhìn thấy tương_lai không mấy sáng_sủa trước_mắt nói là đen_tối cũng được,2025-05-09 07:24:34+00:00
Chuyển đổi số,tại sao doanh nghiệp cần phải chuyển đổi số trong thời đại số các doanh nghiệp truyền thống vẫn đang hoạt động trong một kỷ nguyên cũ kỹ nơi hồ sơ kiểm toán nằm trên giấy tờ quy trình quản lý còn thủ công và thiếu sự kết nối dữ liệu điều,tại_sao doanh_nghiệp cần phải chuyển_đổi số trong thời_đại số các doanh_nghiệp truyền_thống vẫn đang hoạt_động trong một kỷ_nguyên cũ_kỹ nơi hồ_sơ kiểm_toán nằm trên giấy_tờ quy_trình quản_lý còn thủ_công và thiếu sự kết_nối dữ_liệu điều,2025-05-09 03:29:47+00:00
Giáo dục,xây dựng trên solana tận dụng tốc độ cao và chi phí thấp ứng dụng thực tế truyền phát nội dung 3d giáo dục y tế giải trí không chỉ metaverse,xây_dựng trên solana tận_dụng tốc_độ cao và chi_phí thấp ứng_dụng thực_tế truyền phát nội_dung 3d giáo_dục y_tế giải_trí không_chỉ metaverse,2025-05-15 15:59:18+00:00
Giáo dục,tôi thấy bài viết này mang tính giáo dục cao tôi biết ơn sự khôn ngoan mà bạn đã chia sẻ julian mckelvin,tôi thấy bài viết này mang tính giáo_dục cao tôi biết_ơn sự khôn_ngoan mà bạn đã chia_sẻ julian mckelvin,2025-05-15 15:46:56+00:00
Giáo dục,ồ mày cố sủa cũng chỉ để khẳng định mày mang adn của thứ chó săn chó dại bại não mà thôi mày đang tự ỉa vào mồm mày đấy mày nên nhớ tao ko bao giờ vào nhà khác thể hiện văn hóa vô học vô giáo dục như mày,ồ mày cố sủa cũng chỉ để khẳng_định mày mang adn của thứ chó_săn chó dại bại não mà thôi mày đang tự ỉa vào mồm mày đấy mày nên nhớ tao ko bao_giờ vào nhà khác thể_hiện văn_hoá vô_học vô_giáo_dục như mày,2025-05-15 15:33:34+00:00
Giáo dục,các dự án như phát triển năng lượng tái tạo xây dựng hạ tầng giao thông và cải thiện chất lượng giáo dục đang được chú trọng để thúc đẩy kinh tế và môi trường bền vững,các dự_án như phát_triển năng_lượng tái_tạo xây_dựng hạ_tầng giao_thông và cải_thiện chất_lượng giáo_dục đang được chú_trọng để thúc_đẩy kinh_tế và môi_trường bền_vững,2025-05-15 14:56:09+00:00
Giáo dục,ko thiếu ng giỏi nhưng người giỏi ko phải từ hệ thống giáo dục của nam tàu,ko thiếu ng giỏi nhưng người giỏi ko phải từ hệ_thống giáo_dục của nam tàu,2025-05-15 14:43:22+00:00
Giáo dục,tôi thấy bài viết này mang tính giáo dục cao lời khuyên của bạn có giá trị bằng vàng cảm ơn bạn graig wohlwendi,tôi thấy bài viết này mang tính giáo_dục cao lời khuyên của bạn có giá_trị bằng vàng cảm_ơn bạn graig wohlwendi,2025-05-15 14:21:09+00:00
Giáo dục,3 cầu nối đến web2 áp dụng trong các nền tảng truyền thống cần xác minh danh tính nhưng không muốn thu thập thông tin cá nhân ngân hàng số tuyển dụng hệ thống giáo dục vv,3 cầu_nối đến web2 áp_dụng trong các nền_tảng truyền_thống cần xác_minh danh_tính nhưng không muốn thu_thập thông_tin cá_nhân ngân_hàng số tuyển_dụng hệ_thống giáo_dục vv,2025-05-15 14:01:43+00:00
Giáo dục,cùng các anh hùng nhí giải cứu trái đất với ecoheroes game web3 giáo dục bảo vệ môi trường đầy sắc màu read more web3game,cùng các anh_hùng nhí giải_cứu trái_đất với ecoheroes game web3 giáo_dục bảo_vệ môi_trường đầy sắc_màu read more web3game,2025-05-15 13:58:59+00:00
Giáo dục,mảng nào cũng có mặt mexc từ giáo dục tới thể thao kkk,mảng nào cũng có_mặt mexc từ giáo_dục tới thể_thao kkk,2025-05-15 13:29:04+00:00
Giáo dục,công nghệ arvr đang có xu hướng tăng trưởng mạnh mẽ mang lại trải nghiệm immersive cho người dùng trong nhiều lĩnh vực như giải trí giáo dục và y tế,công_nghệ arvr đang có xu_hướng tăng_trưởng mạnh_mẽ mang lại trải_nghiệm immersive cho người dùng trong nhiều lĩnh_vực như giải_trí giáo_dục và y_tế,2025-05-15 13:17:20+00:00
Giáo dục,quỹ từ thiện của kết nối trường học ở benin với starlink thúc đẩy bình đẳng kỹ thuật số qua sáng kiến cầu nối hy vọng giáo dục công nghệ nhân văn chi tiết,quỹ từ_thiện của kết_nối trường_học ở benin với starlink thúc_đẩy bình_đẳng kỹ_thuật_số qua sáng_kiến cầu_nối hy_vọng giáo_dục công_nghệ nhân_văn chi_tiết,2025-05-15 12:23:32+00:00
Giáo dục,gpt5 có khả năng cải thiện tương tác con ngườimáy hỗ trợ trong giáo dục sáng tạo nội dung và dịch thuật mang lại trải nghiệm tối ưu hơn cho người dùng,gpt5 có khả_năng cải_thiện tương_tác con ngườimáy hỗ_trợ trong giáo_dục sáng_tạo nội_dung và dịch_thuật mang lại trải_nghiệm tối_ưu hơn cho người dùng,2025-05-15 12:09:47+00:00
Giáo dục,mới đây qua internet công an ca nhận diện 18 người nghệ an giương cờ vnch trước đại sứ quán vn ở london xử lý gọi người nhà tới nghe thông báo sai phạm bị dụ dỗ lôi kéo đề nghị phối hợp quản lý giáo dục nkyn,mới_đây qua internet công_an ca nhận_diện 18 người nghệ_an giương cờ vnch trước đại_sứ_quán vn ở london xử_lý gọi người_nhà tới nghe thông_báo sai_phạm bị dụ_dỗ lôi_kéo đề_nghị phối_hợp quản_lý giáo_dục nkyn,2025-05-15 11:47:10+00:00
Giáo dục,vậy còn rất nhiều cơ quan nữasách giáo khoa giả nữa bố ơi1 quốc gia mà y tế với giáo dục là ại diện của sự phát triển của ất nước mà việc nam hiện tại là y tế và giáo dục toàn là lãnh đạo nhà nước hủy diệt 1 cách nhẫn tâm không từ nào nói,vậy còn rất nhiều cơ_quan nữasách giáo_khoa giả nữa bố ơi1 quốc_gia mà y_tế với giáo_dục là ại diện của sự phát_triển của ất nước mà việc nam hiện_tại là y_tế và giáo_dục toàn là lãnh_đạo nhà_nước huỷ_diệt 1 cách nhẫn_tâm không từ nào nói,2025-05-15 10:27:57+00:00
Giáo dục,bên cạnh lĩnh vực sức khỏe susan kinh doanh trong lĩnh vực giáo dục bạn có thể chọn hợp tác với susan làm 1 trong 2 hoặc cả 2 không cần tiền nhưng cần vốn liên hệ susan để biết chi tiết flex45 ngày 51365,bên cạnh lĩnh_vực sức_khoẻ susan kinh_doanh trong lĩnh_vực giáo_dục bạn có_thể chọn hợp_tác với susan làm 1 trong 2 hoặc cả 2 không cần tiền nhưng cần vốn liên_hệ susan để biết chi_tiết flex45 ngày 51365,2025-05-15 10:13:03+00:00
Giáo dục,sách giáo khoa giả tiếp nối xã hội gì mà y tế rồi tới giáo dục 1 quốc gia mà 2 yếu tố cơ bản y tế giáo dục tồi tệ thì mãi mãi mãi mãi là 1quốc gia không phát triển,sách_giáo_khoa giả tiếp_nối xã_hội gì mà y_tế rồi tới giáo_dục 1 quốc_gia mà 2 yếu_tố cơ_bản y_tế giáo_dục tồi_tệ thì mãi_mãi mãi_mãi là 1quốc gia không phát_triển,2025-05-15 09:53:36+00:00
Giáo dục,trong mùa tuyển sinh đại học 2025 bộ giáo dục amp đào tạo mong muốn siết chỉ tiêu tuyển sinh sớm tại các trường đại học xuống còn tối đa 20,trong mùa tuyển_sinh đại_học 2025 bộ giáo_dục amp đào_tạo mong_muốn siết chỉ_tiêu tuyển_sinh sớm tại các trường đại_học xuống còn tối_đa 20,2025-05-15 09:48:42+00:00
