Keyword,Text_Clean,Text_Segmented,Created_At
Kinh tế,cho về ấn độ giúp đắt nước phát triển kinh tế tự do đi all nam mô a di đà phật,cho về ấn_độ giúp đắt nước phát_triển kinh_tế tự_do đi all nam_mô a di đà phật,2025-05-15 11:08:16+00:00
Kinh tế,công trạng lão này lớn lắm từ dịch covid đến khi mỹ áp thuế 46 ko có 1 tí năng lực nào để điều hành kinh tế,công_trạng lão này lớn lắm từ_dịch covid đến khi mỹ áp_thuế 46 ko có 1 tí năng_lực nào để điều_hành kinh_tế,2025-05-15 11:03:25+00:00
Kinh tế,pi sinh ra không để định giá mua bán trên sàn mà nó là phương tiện tài chính dẫn dắt chúng ta đến web 3 blockchain vs thế giới kinh tế tài chính bla mẹ vừa ra mắt quỹ 100tr đô pi cổ phần giảm luôn từ 11 083 mà bọn ngáo còn hô to,pi sinh ra không để định_giá mua_bán trên sàn mà nó là phương_tiện tài_chính dẫn_dắt chúng_ta đến web 3 blockchain vs thế_giới kinh_tế tài_chính bla mẹ vừa ra_mắt quỹ 100tr đô pi cổ_phần giảm luôn từ 11 083 mà bọn ngáo còn hô to,2025-05-15 11:01:32+00:00
Kinh tế,hoa kỳ vẫn tiếp tục cho trung quốc lợi dụng và hút máu kinh tế hoa kỳ như vậy chỉ làm trung quốc mạnh lên và là đối thủ đáng gờm trong tương lai trung quốc hất cảng hoa kỳ khỏi ấn độ thái bình dương,hoa_kỳ vẫn tiếp_tục cho trung_quốc lợi_dụng và hút máu kinh_tế hoa_kỳ như_vậy chỉ làm trung_quốc mạnh lên và là đối_thủ đáng gờm trong tương_lai trung_quốc hất cảng hoa_kỳ khỏi ấn_độ thái_bình dương,2025-05-15 11:00:02+00:00
Kinh tế,lịch họp fomc năm 2025 công bố lãi suất quan trọng 17186 16179 91012 anh em nhớ theo dõi kỹ để cập nhật những thông tin kinh tế quan trọng từ đó có quyết định đầu tư phù hợp nhé fomc lichhopfomc laisuat taichinh kinhte fed,lịch họp fomc năm 2025 công_bố lãi_suất quan_trọng 17186 16179 91012 anh_em nhớ theo_dõi kỹ để cập_nhật những thông_tin kinh_tế quan_trọng từ đó có quyết_định đầu_tư phù_hợp nhé fomc lichhopfomc laisuat taichinh kinhte fed,2025-05-15 10:55:19+00:00
Kinh tế,chụp ảnh giờ còn có giá trị kinh tế,chụp ảnh giờ còn có giá_trị kinh_tế,2025-05-15 10:44:28+00:00
Kinh tế,hèn chi văn hóa vn là tối ngày ru rú tại gia nên đó là 50 năm nay kinh tế vn éooo lên nổi là vậy có hiểu sự đi lại kích cầu nhu cầu thế giới ko ông mà mà bòa đỏ có tiền để đi ko ta giờ chả biết nó trốn mịa kuli hết đâu zồi haizzz,hèn_chi văn_hoá vn là tối_ngày ru_rú tại_gia nên đó là 50 năm nay kinh_tế vn éooo lên nổi là vậy có hiểu sự đi_lại kích_cầu nhu_cầu thế_giới ko ông mà mà boà đỏ có tiền để đi ko ta giờ chả biết nó trốn mịa kuli hết đâu zồi haizzz,2025-05-15 10:43:32+00:00
Kinh tế,ngày 155 giá xăng được điều chỉnh tăng sau 2 lần giảm,ngày 155 giá xăng được điều_chỉnh tăng sau 2 lần giảm,2025-05-15 10:36:30+00:00
Kinh tế,mùa sau kinh tế phát triển ai cần giữ giá trị vào btc làm gì trong việc vận hành doanh nghiệp nếu áp dụng được blockchain vào thì eth sol avax chainlink lại tung nóc,mùa sau kinh_tế phát_triển ai cần giữ giá_trị vào btc làm gì trong việc vận_hành doanh_nghiệp nếu áp_dụng được blockchain vào thì eth sol avax chainlink lại tung nóc,2025-05-15 10:35:43+00:00
Kinh tế,ở nga đã có đủ các nhà kinh tế và luật sư rồi chúng ta cần bác sĩ và kỹ sư 53 sinh viên học theo hình thức tự trả học phí hầu hết họ đều là nhà kinh tế,ở nga đã có đủ các nhà_kinh_tế và luật_sư rồi chúng_ta cần bác_sĩ và kỹ_sư 53 sinh_viên học theo hình_thức tự trả học_phí hầu_hết họ đều là nhà_kinh_tế,2025-05-15 10:34:01+00:00
Kinh tế,chỉ 24 giờ trước thị trường còn rất khác giờ thì sao trump ký thỏa thuận 12 nghìn tỷ usd boeing lập kỳ tích kinh tế tq phát tín hiệu nguy hiểm bạn đã sẵn sàng cho bước tiếp theo chưa,chỉ 24 giờ trước thị_trường còn rất khác giờ thì sao trump ký thoả_thuận 12 nghìn tỷ usd boeing lập kỳ_tích kinh_tế tq phát tín_hiệu nguy_hiểm bạn đã sẵn_sàng cho bước tiếp_theo chưa,2025-05-15 10:29:31+00:00
Kinh tế,bot slim đào mộng tìm botcen ạkhu vực kinh tếgửi hình xem hàng trước khi ib,bot slim đào mộng tìm botcen ạkhu vực kinh tếgửi hình xem hàng trước khi ib,2025-05-15 10:27:20+00:00
Kinh tế,nhà kinh tế phát cảnh báo đến michael saylor giữa cơn sốt mua bitcoin mới nhất tintucbitcoin bitcoin floppypepe michaelsaylor,nhà_kinh_tế phát cảnh_báo đến michael saylor giữa cơn_sốt mua bitcoin mới nhất tintucbitcoin bitcoin floppypepe michaelsaylor,2025-05-15 10:18:02+00:00
Kinh tế,thủ tướng barbados mia amor mottley kêu gọi xây dựng hệ thống thương mại đa phương công bằng đây là yếu tố sống còn cho các quốc gia nhỏ và đang phát triển giúp thúc đẩy ổn định kinh tế cần hợp tác để duy trì tính minh bạch và,thủ_tướng barbados mia amor mottley kêu_gọi xây_dựng hệ_thống thương_mại đa_phương công_bằng đây là yếu_tố sống_còn cho các quốc_gia nhỏ và đang phát_triển giúp thúc_đẩy ổn_định kinh_tế cần hợp_tác để duy_trì tính minh_bạch và,2025-05-15 10:14:44+00:00
Kinh tế,nguyên đám g7 toàn là đệ tự của thằng súc vật claus schwab lãnh tụ diễn đàn kinh tế thế giới wef,nguyên đám g7 toàn là đệ tự của thằng súc_vật claus schwab lãnh_tụ diễn_đàn kinh_tế thế_giới wef,2025-05-15 10:10:46+00:00
Kinh tế,bài đăng 1 cuộc cách mạng về tiền điện tử đã đến giverep giverepairdrop givereployalty bài đăng 2 blockchain công nghệ cải thế giới tài chính và kinh tế giverep giverepairdrop givereployalty,bài đăng 1 cuộc cách_mạng về tiền điện_tử đã đến giverep giverepairdrop givereployalty bài đăng 2 blockchain công_nghệ cải thế_giới tài_chính và kinh_tế giverep giverepairdrop givereployalty,2025-05-15 10:08:06+00:00
Kinh tế,dm bọn cs này đéo nghĩ đc cách gì để phát triển kinh tế quanh namq chỉ nghĩ cách hút máu đéo biết dân việt nam còn chịu đựng bọn này bao lâu nữa thì đứng lên đây,dm bọn cs này đéo nghĩ đc cách gì để phát_triển kinh_tế quanh namq chỉ nghĩ cách hút máu đéo biết dân việt_nam còn chịu_đựng bọn này bao_lâu nữa thì đứng lên đây,2025-05-15 10:02:35+00:00
Kinh tế,trong tập này chúng tôi phân tích hiệu quả của các lệnh trừng phạt của phương tây đối với nga và khám phá lý do tại sao bất chấp áp lực lịch sử nền kinh tế nga vẫn tiếp tục tăng trưởng,trong tập này chúng_tôi phân_tích hiệu_quả của các lệnh trừng_phạt của phương tây đối_với nga và khám_phá lý_do tại_sao bất_chấp áp_lực lịch_sử nền kinh_tế nga vẫn tiếp_tục tăng_trưởng,2025-05-15 10:02:21+00:00
Kinh tế,alva cũng cho rằng biến động thị trường tối nay sẽ cực kỳ mạnh do loạt dữ liệu kinh tế mỹ ppi bán lẻ và phát biểu chủ tịch fed powell có thể dẫn đến bán tháo hoặc đảo chiều khi tâm lý hoảng loạn và kỳ vọng chính sách diễn biến trái chiều,alva cũng cho rằng biến_động thị_trường tối nay sẽ cực_kỳ mạnh do loạt dữ_liệu kinh_tế mỹ ppi bán_lẻ và phát_biểu chủ_tịch fed powell có_thể dẫn đến bán_tháo hoặc đảo chiều khi tâm_lý hoảng_loạn và kỳ_vọng chính_sách diễn_biến trái chiều,2025-05-15 09:53:28+00:00
Kinh tế,mày ngu nói sai mà còn bày đặt lên lớpng dân nào k đóng thuế chứ thuế vatxăng dầu tiêu thụ đặc biệt là jđéo biết j về thuế về kinh tế thì im mẹ mồm lại,mày ngu nói sai mà_còn bày_đặt lên lớpng dân nào k đóng thuế chứ thuế vatxăng dầu tiêu_thụ đặc_biệt là jđéo biết j về thuế về kinh_tế thì im mẹ mồm lại,2025-05-15 09:36:53+00:00
Kinh tế,tại qatar tổng thống donald j trump đã ký một thỏa thuận với qatar để tạo ra một cuộc trao đổi kinh tế trị giá ít nhất 12 ngàn tỷ đô la tòa bạch ốc thông báo ngoài thỏa thuận tài liệu nêu rõ các công ty hoa kỳ và qatar đã đạt được thỏa,tại qatar tổng_thống donald j trump đã ký một thoả_thuận với qatar để tạo ra một cuộc trao_đổi kinh_tế trị_giá ít_nhất 12 ngàn tỷ đô_la toà bạch ốc thông_báo ngoài thoả_thuận tài_liệu nêu rõ các công_ty hoa_kỳ và qatar đã đạt được thoả,2025-05-15 09:30:27+00:00
Kinh tế,mục đích làm để làm chủ công nghệ và đẩy mạnh kinh tế tư nhân không phải để bằng chị bằng em,mục_đích làm để làm chủ công_nghệ và đẩy_mạnh kinh_tế tư_nhân không phải để bằng chị bằng em,2025-05-15 09:28:34+00:00
Kinh tế,aid alpha harvest chương trình thử nghiệm trước mainnet tiềm năng của là viết tắt của gpu ai amp financialization gaib là một nền tảng tài chính phi tập trung tiên phong nhằm xây dựng lớp kinh tế cho trí tuệ nhân tạo ai và năng lực tính toán,aid alpha harvest chương_trình thử_nghiệm trước mainnet tiềm_năng của là viết tắt của gpu ai amp financialization gaib là một nền_tảng tài_chính phi tập_trung tiên_phong nhằm xây_dựng lớp kinh_tế cho trí_tuệ_nhân_tạo ai và năng_lực tính_toán,2025-05-15 09:26:56+00:00
Kinh tế,thịt trai gym chưa bao giờ dễ dàng đến thế chỉ cần khi bạn có kinh tế với dung dịch gây mê cực mạnh của shop đánh gục mọi loại cơ địa trai thẳng dùng theo hướng dẫn của chuyên gia ship qte chỉ 57 ngày lh,thịt trai gym chưa bao_giờ dễ_dàng đến thế chỉ cần khi bạn có kinh_tế với dung_dịch gây_mê cực mạnh của shop đánh_gục mọi loại cơ_địa trai thẳng dùng theo hướng_dẫn của chuyên_gia ship qte chỉ 57 ngày lh,2025-05-15 09:15:47+00:00
Kinh tế,bitcoin dao động quanh vùng giá quen thuộc trong phiên mở cửa phố wall ngày 145 khi giới đầu tư thận trọng chờ đợi các tín hiệu kinh tế vĩ mô mới từ hoa kỳ,bitcoin dao_động quanh vùng giá quen_thuộc trong phiên mở_cửa phố wall ngày 145 khi giới đầu_tư thận_trọng chờ_đợi các tín_hiệu kinh_tế vĩ_mô mới từ hoa_kỳ,2025-05-15 09:12:50+00:00
Kinh tế,trong khi nền kinh tế đang khủng hoảng thì việt cộng quyết làm vụ này để lấy tiếng phát triển tham nhũng khủng và để trung quấc thâu tóm việt nam mau hơn,trong khi nền kinh_tế đang khủng_hoảng thì việt cộng quyết làm vụ này để lấy tiếng phát_triển tham_nhũng khủng và để trung quấc thâu_tóm việt_nam mau hơn,2025-05-15 09:10:19+00:00
Kinh tế,cao có thể dùng làm vũ khí đồng ý chỉ làm giàu uranium ở mức thấp hơn cần thiết cho mục đích dân sự và cho phép các thanh tra viên quốc tế giám sát quá trình này để đổi lấy việc dỡ bỏ ngay lập tức mọi lệnh trừng phạt kinh tế đối với iran,cao có_thể dùng làm vũ_khí đồng_ý chỉ làm_giàu uranium ở mức thấp hơn cần_thiết cho mục_đích dân_sự và cho_phép các thanh_tra_viên quốc_tế giám_sát quá_trình này để đổi lấy việc dỡ bỏ ngay_lập_tức mọi lệnh trừng_phạt kinh_tế đối_với iran,2025-05-15 09:06:36+00:00
Kinh tế,trung quốc sắp công bố chi tiết về cơ chế đối thoại thương mại mới với mỹ nhấn mạnh cam kết giải quyết vấn đề kinh tế qua đối thoại đây là bước đi thể hiện sự hợp tác trong bối cảnh toàn cầu thay đổi nhanh chóng hãy theo,trung_quốc sắp công_bố chi_tiết về cơ_chế đối_thoại thương_mại mới với mỹ nhấn_mạnh cam_kết giải_quyết vấn_đề kinh_tế qua đối_thoại đây là bước_đi thể_hiện sự hợp_tác trong bối_cảnh toàn_cầu thay_đổi nhanh_chóng hãy theo,2025-05-15 09:06:28+00:00
Kinh tế,ngân hàng nhân dân trung quốc sẽ cắt giảm tỷ lệ dự trữ bắt buộc rrr bắt đầu từ 1552024 bơm hơn 1 nghìn tỷ nhân dân tệ vào thị trường động thái này nhằm ổn định tài chính hỗ trợ doanh nghiệp và thúc đẩy tăng trưởng kinh tế,ngân_hàng nhân_dân trung_quốc sẽ cắt_giảm tỷ_lệ dự_trữ bắt_buộc rrr bắt_đầu từ 1552024 bơm hơn 1 nghìn tỷ nhân_dân_tệ vào thị_trường động_thái này nhằm ổn_định tài_chính hỗ_trợ doanh_nghiệp và thúc_đẩy tăng_trưởng kinh_tế,2025-05-15 09:06:13+00:00
Kinh tế,cuộc họp thứ 31 của các bộ trưởng thương mại apec đang diễn ra tại jeju hàn quốc trong bối cảnh kinh tế toàn cầu gặp nhiều thách thức tăng trưởng khu vực apec dự báo chỉ đạt 26 vào năm 2025 sự hợp tác và đổi mới trong thươ,cuộc họp thứ 31 của các bộ_trưởng thương_mại apec đang diễn ra tại jeju hàn_quốc trong bối_cảnh kinh_tế toàn_cầu gặp nhiều thách_thức tăng_trưởng khu_vực apec dự_báo chỉ đạt 26 vào năm 2025 sự hợp_tác và đổi_mới trong thươ,2025-05-15 09:05:13+00:00
Kinh tế,hôm thứ tư 145 nhà trắng loan báo rằng hoa kỳ và qatar đã đạt được một thỏa thuận sẽ tạo ra ít nhất 12 nghìn tỷ usd trao đổi kinh tế,hôm thứ tư 145 nhà_trắng loan_báo rằng hoa_kỳ và qatar đã đạt được một thoả_thuận sẽ tạo ra ít_nhất 12 nghìn tỷ usd trao_đổi kinh_tế,2025-05-15 09:00:09+00:00
Kinh tế,bitcoin tiếp tục giao dịch ngang trên mức 104000 trong bối cảnh thị trường chứng khoán lạnh giá chờ đợi những diễn biến tiếp theo cả về mặt thương mại và dữ liệu kinh tế btc xscomvietnam,bitcoin tiếp_tục giao_dịch ngang trên mức 104000 trong bối_cảnh thị_trường_chứng_khoán lạnh_giá chờ_đợi những diễn_biến tiếp_theo cả về mặt thương_mại và dữ_liệu kinh_tế btc xscomvietnam,2025-05-15 08:59:00+00:00
Kinh tế,kinh tế việt nam 5 ngàn năm nữa cũng không bằng kinh tế california điều đó là sự thật chúc một ngày tốt lành vietnams economy in 5 thousand years will not be equal to californias economy its truth have a good one ya x meta freedom copyrightbyhuydang,kinh_tế việt_nam 5 ngàn năm nữa cũng không bằng kinh_tế california điều đó là sự_thật chúc một ngày tốt_lành vietnams economy in 5 thousand years will not be equal to californias economy its truth have a good one ya x meta freedom copyrightbyhuydang,2025-05-15 08:45:42+00:00
Kinh tế,bản chất gamefi là một ngách nhỏ của defi nhưng nó được phép khoác lên mình một chiếc áo đầy màu sắc và tự do thiên biến chỉ cần một nền kinh tế bền vững trong gamefi xuất hiện chắc chắn nó sẽ được defi sao chép gdollarve33,bản_chất gamefi là một ngách nhỏ của defi nhưng nó được phép khoác lên mình một chiếc áo đầy màu_sắc và tự_do thiên biến chỉ cần một nền kinh_tế bền_vững trong gamefi xuất_hiện chắc_chắn nó sẽ được defi sao_chép gdollarve33,2025-05-15 08:15:31+00:00
Kinh tế,ngoại trưởng đan mạch lars lokke rasmussen sẽ thăm trung quốc đại lục từ 1720 tháng năm chuyến đi này hứa hẹn củng cố mối quan hệ ngoại giao và thúc đẩy hợp tác chính trị kinh tế văn hóa theo dõi để thấy sức mạnh của ngoại,ngoại_trưởng đan_mạch lars lokke rasmussen sẽ thăm trung_quốc đại_lục từ 1720 tháng năm chuyến đi này hứa_hẹn củng_cố mối quan_hệ ngoại_giao và thúc_đẩy hợp_tác chính_trị kinh_tế văn_hoá theo_dõi để thấy sức_mạnh của ngoại,2025-05-15 08:07:32+00:00
Kinh tế,lượng đặt hàng vận tải biển từ mỹ sang trung quốc đã tăng gần 300 sau khi giảm thuế quan theo vizion điều này cho thấy sự phục hồi tích cực trong thương mại và niềm tin ngày càng tăng vào mối quan hệ kinh tế giữa hai quốc gia,lượng đặt_hàng vận_tải_biển từ mỹ sang trung_quốc đã tăng gần 300 sau khi giảm thuế_quan theo vizion điều này cho thấy sự phục_hồi tích_cực trong thương_mại và niềm tin ngày_càng tăng vào mối quan_hệ kinh_tế giữa hai quốc_gia,2025-05-15 08:07:00+00:00
Kinh tế,thương mại trung quốc về việc thiết lập cơ chế đàm phán thương mại với mỹ trung quốc luôn sẵn sàng giải quyết quan hệ kinh tế thương mại thông qua kênh không chính thức,thương_mại trung_quốc về việc thiết_lập cơ_chế đàm_phán thương_mại với mỹ trung_quốc luôn sẵn_sàng giải_quyết quan_hệ kinh_tế thương_mại thông_qua kênh không chính_thức,2025-05-15 08:06:44+00:00
Kinh tế,bộ trưởng kinh tế đức không có ai thắng trong các cuộc chiến thương mại ủng hộ ủy ban châu âu,bộ_trưởng kinh_tế đức không có ai thắng trong các cuộc_chiến thương_mại ủng_hộ uỷ_ban châu_âu,2025-05-15 08:06:38+00:00
Kinh tế,nền kinh tế cruise đang thúc đẩy sự phát triển mạnh mẽ cho du lịch và dịch vụ tại trung quốc với sự phục hồi và chính sách tiện lợi cơ hội du lịch sẽ trở nên phong phú hơn cho thế hệ trẻ hướng đi này không chỉ tạo nên trải,nền kinh_tế cruise đang thúc_đẩy sự phát_triển mạnh_mẽ cho du_lịch và dịch_vụ tại trung_quốc với sự phục_hồi và chính_sách tiện_lợi cơ_hội du_lịch sẽ trở_nên phong_phú hơn cho thế_hệ trẻ hướng đi này không_chỉ tạo nên trải,2025-05-15 08:05:31+00:00
Kinh tế,ế là một lợi thế cho chúng ta tính kế xoay chuyển tình thế quản lý tiền tệ đến một ngày kinh tế sẽ đủ sức khống chế tình yêu bound by the fate mygoldenbloodep10,ế là một lợi_thế cho chúng_ta tính kế xoay_chuyển tình_thế quản_lý tiền_tệ đến một ngày kinh_tế sẽ đủ sức khống_chế tình_yêu bound by the fate mygoldenbloodep10,2025-05-15 08:03:00+00:00
Kinh tế,có ai học kinh tế huế k ạ ib,có ai học kinh_tế huế k ạ ib,2025-05-15 08:02:33+00:00
Kinh tế,bạn đang theo dõi chỉ số kinh tế nào nhiều nhất trong tháng này hãy cho chúng tôi biết lựa chọn của bạn nhé,bạn đang theo_dõi chỉ_số kinh_tế nào nhiều nhất trong tháng này hãy cho chúng_tôi biết lựa_chọn của bạn nhé,2025-05-15 08:01:33+00:00
Kinh tế,sự gia tăng bất ổn thương mại được dự báo sẽ gây áp lực lên nền kinh tế thế giới và kéo theo nhu cầu dầu suy giảm iea cho biết trong báo cáo thị trường dầu tháng 05,sự gia_tăng bất_ổn thương_mại được dự_báo sẽ gây áp_lực lên nền kinh_tế thế_giới và kéo_theo nhu_cầu dầu suy_giảm iea cho biết trong báo_cáo thị_trường dầu tháng 05,2025-05-15 08:01:13+00:00
Kinh tế,trump qua vn chơi là công an kinh tế bắt luôn về quy án,trump qua vn chơi là công_an kinh_tế bắt luôn về quy án,2025-05-15 07:23:47+00:00
Kinh tế,lịch kinh tế đáng chú ý hôm nay 1930 chỉ số ppi doanh số bán lẻ và đề nghị trợ cấp thất nghiệp nếu chỉ số ppi lớn hơn mức dự báo sẽ là tin tiêu cực cho crypto 1940 chủ tịch fed powell phát biểu fed btc,lịch kinh_tế đáng chú_ý hôm_nay 1930 chỉ_số ppi doanh_số bán_lẻ và đề_nghị trợ_cấp thất_nghiệp nếu chỉ_số ppi lớn hơn mức dự_báo sẽ là tin tiêu_cực cho crypto 1940 chủ_tịch fed powell phát_biểu fed btc,2025-05-15 07:15:39+00:00
Kinh tế,tổng thống trump mang về hơn 243 tỷ usd từ qatar thỏa thuận khủng trong chuyến thăm qatar ngày 1405 ông trump đạt được các thỏa thuận trị giá 2435 tỷ usd được nhà trắng xem là bước đệm hướng tới cam kết kinh tế 1200 tỷ usd với qatar điểm nhấn,tổng_thống trump mang về hơn 243 tỷ usd từ qatar thoả_thuận khủng trong chuyến thăm qatar ngày 1405 ông trump đạt được các thoả_thuận trị_giá 2435 tỷ usd được nhà_trắng xem là bước đệm hướng tới cam_kết kinh_tế 1200 tỷ usd với qatar điểm nhấn,2025-05-15 07:06:42+00:00
Kinh tế,cảnh báo lịch kinh tế tối nay thị trường sẽ xoay như chong chóng dự kiến hơn 1 tỉ usdt sẽ bị thanh lý trong tối nay cảnh báo không nhồi lệnh không vào lệnh liên tục khung giờ nguy hiểm 19h30 21h00 tin ra liên tục dễ thịt,cảnh_báo lịch kinh_tế tối nay thị_trường sẽ xoay như chong_chóng dự_kiến hơn 1 tỉ usdt sẽ bị thanh_lý trong tối nay cảnh_báo không nhồi lệnh không vào lệnh liên_tục khung giờ nguy_hiểm 19h30 21h00 tin ra liên_tục dễ thịt,2025-05-15 07:05:53+00:00
Kinh tế,nxpc token là gì giao thức web3 ip maplestory universe nexpace nxpc là token gốc của nexpace giao thức web3 mở rộng ip maplestory universe tích hợp blockchain để tái định nghĩa kinh tế game mmorpg xem thêm,nxpc token là gì giao_thức web3 ip maplestory universe nexpace nxpc là token gốc của nexpace giao_thức web3 mở_rộng ip maplestory universe tích_hợp blockchain để tái định_nghĩa kinh_tế game mmorpg xem thêm,2025-05-15 07:05:21+00:00
Kinh tế,dự thảo nghị quyết phát triển kinh tế tư nhân quy định không thanh tra kiểm tra doanh nghiệp hộ kinh doanh quá 1 lầnnăm trừ trường hợp có bằng chứng vi phạm rõ ràng đồng thời ưu tiên khắc phục hậu quả kinh tế thay vì xử lý hình sự,dự_thảo nghị_quyết phát_triển kinh_tế tư_nhân quy_định không thanh_tra kiểm_tra doanh_nghiệp hộ kinh_doanh quá 1 lầnnăm trừ trường_hợp có bằng_chứng vi_phạm rõ_ràng đồng_thời ưu_tiên khắc_phục hậu_quả kinh_tế thay_vì xử_lý hình_sự,2025-05-15 06:59:53+00:00
Kinh tế,nha trang khánh hòa nữ 2k1 khá xinh kĩ năng ổn sở thích du lịch nghe nhạc muốn tìm fwb lịch sự kín đáo không ràng buộc bạn nữ kĩ năng ổn hiện tại tự chủ kinh tế thời gian rảnh linh hoạt,nha_trang khánh_hoà nữ 2k1 khá xinh kĩ_năng ổn sở_thích du_lịch nghe nhạc muốn tìm fwb lịch_sự kín_đáo không ràng_buộc bạn nữ kĩ_năng ổn hiện_tại tự_chủ kinh_tế thời_gian rảnh linh_hoạt,2025-05-15 06:54:17+00:00
Thương mại,vậy trước hết hãy vịn thằng khỉ đột vượng nó chính là kẻ gian lận thương mại lớn nhứt xứ vịt đó,vậy trước_hết hãy vịn thằng khỉ_đột vượng nó chính là kẻ_gian lận thương_mại lớn nhứt xứ vịt đó,2025-05-15 10:51:14+00:00
Thương mại,các bộ trưởng thương mại apec họp trong bối cảnh cuộc chiến thuế quan leo thang,các bộ_trưởng thương_mại apec họp trong bối_cảnh cuộc_chiến thuế_quan leo_thang,2025-05-15 09:51:35+00:00
Thương mại,thị trường toàn cầu đang trên đà tăng mạnh sau khi thỏa thuận mỹtrung vừa có tiến triển tốt đẹp liệu đây là khởi đầu cho chu kỳ tăng giá mới hay là đợt phục hồi trong ngắn hạn tìm hiểu ngay dooprime thitruong chungkhoan,thị_trường toàn_cầu đang trên đà tăng mạnh sau khi thoả_thuận mỹtrung vừa có tiến_triển tốt_đẹp liệu đây là khởi_đầu cho chu_kỳ tăng_giá mới hay_là đợt phục_hồi trong ngắn_hạn tìm_hiểu ngay dooprime thitruong chungkhoan,2025-05-15 09:07:46+00:00
Thương mại,1 trung quốc kêu gọi mỹ chấm dứt sớm việc áp thuế 232 đối với hàng hóa như ô tô thép nhôm và thuốc nhập khẩu 2 trung quốc chỉ trích mạnh mẽ biện pháp của mỹ cho rằng đây là hành động đơn phương bảo hộ thương mại gây tổn hại đến quyền lợi c,1 trung_quốc kêu_gọi mỹ chấm_dứt sớm việc áp_thuế 232 đối_với hàng_hoá như ô_tô thép nhôm và thuốc nhập_khẩu 2 trung_quốc chỉ_trích mạnh_mẽ biện_pháp của mỹ cho rằng đây là hành_động đơn_phương bảo_hộ thương_mại gây tổn_hại đến quyền_lợi c,2025-05-15 08:28:26+00:00
