Keyword,Text_Clean,Text_Segmented,Created_At
Chính trị,kẻ địch của thế giới là ai có phải là toàn bộ hệ thống chính trị trên toàn cầu ko hàng tỉ tín đồ theo giáo phái satan cứu kiểu gì dọn dẹp thế giới kiểu gì để giảm thiểu rủi ro nhất giờ này bảo vax covid độc còn bị tẩn ko trượt phát nào kìa,kẻ địch của thế_giới là ai có phải là toàn_bộ hệ_thống chính_trị trên toàn_cầu ko hàng tỉ tín_đồ theo giáo_phái satan cứu kiểu gì dọn_dẹp thế_giới kiểu gì để giảm_thiểu rủi_ro nhất giờ này bảo vax covid độc còn bị tẩn ko trượt phát nào kìa,2025-05-15 03:58:46+00:00
Chính trị,ngoài nhu cầu sinh tồn người dân văn minh còn cần có quyền tự chủ đất nước chẳng hạn như quyền tham gia hoặc thành lập các đảng phái chính trị và quyền bỏ phiếu,ngoài nhu_cầu sinh_tồn người_dân văn_minh còn cần có quyền tự_chủ đất_nước chẳng_hạn như quyền tham_gia hoặc thành_lập các đảng_phái chính_trị và quyền bỏ_phiếu,2025-05-15 03:45:43+00:00
Chính trị,chúng tôi sẽ giết tất cả phụ nữ da trắng chúng tôi sẽ giết tất cả chị em da trắng và chúng tôi thậm chí sẽ giết tất cả thú cưng của các người một chính trị gia da đen ở nam phi,chúng_tôi sẽ giết tất_cả phụ_nữ da trắng chúng_tôi sẽ giết tất_cả chị_em da trắng và chúng_tôi thậm_chí sẽ giết tất_cả thú cưng của các người một chính_trị_gia da đen ở nam_phi,2025-05-15 03:39:10+00:00
Chính trị,đảng dân chủ đang gây áp lực điều tra tổng thống trump nghi ngờ ông lợi dụng quyền lực để trục lợi từ các dự án crypto xem thêm,đảng dân_chủ đang gây áp_lực điều_tra tổng_thống trump nghi_ngờ ông lợi_dụng quyền_lực để trục_lợi từ các dự_án crypto xem thêm,2025-05-15 03:06:37+00:00
Chính trị,theo tin của ô chú ở bct thì tq ko những phải chấp nhận tất cả về 10 mà còn phải chấp nhận thêm 3 đk liên quán đến chính trị đó là 1ko đc động đến đloan2thả nhà hoạt động chính trị không tên3phải phối hợp hợp hoàn toàn ngăn chặn fetamin vào mỹ,theo tin của ô chú ở bct thì tq ko những phải chấp_nhận tất_cả về 10 mà_còn phải chấp_nhận thêm 3 đk liên quán đến chính_trị đó là 1ko đc động đến đloan2thả nhà hoạt_động chính_trị không tên3phải phối_hợp hợp hoàn_toàn ngăn_chặn fetamin vào mỹ,2025-05-15 02:46:29+00:00
Chính trị,tin tức trong cơn xoáy của các biến động toàn cầu từ căng thẳng chính trị ở châu âu chiến sự tại trung đông đến chính sách y tế thắt chặt tại mỹ du lịch nha khoa đang dịch chuyển về đông nam á và việt nam trở thành điểm đến của chỉnh nha,tin_tức trong cơn xoáy của các biến_động toàn_cầu từ căng_thẳng chính_trị ở châu_âu chiến_sự tại trung đông đến chính_sách y_tế thắt chặt tại mỹ du_lịch nha_khoa đang dịch_chuyển về đông nam á và việt_nam trở_thành điểm đến của chỉnh nha,2025-05-15 02:31:24+00:00
Chính trị,một số ý kiến cho rằng vụ việc mang động cơ chính trị nhằm răn đe các nhân vật công khai ủng hộ đối lập trong khi các bên liên quan chưa đưa ra bình luận chính thức hiện vụ việc đang thu hút sự chú ý từ dư luận và cộng đồng người việt tại hoa kỳ,một_số ý_kiến cho rằng vụ_việc mang động_cơ chính_trị nhằm răn_đe các nhân_vật công_khai ủng_hộ đối_lập trong khi các bên liên_quan chưa đưa ra bình_luận chính_thức hiện vụ_việc đang thu_hút sự chú_ý từ dư_luận và cộng_đồng người việt tại hoa_kỳ,2025-05-15 02:09:08+00:00
Chính trị,sau khi công khai ủng hộ donald trump vào năm 2016 ông dương được cho là đối mặt với những áp lực chính trị ngày càng gia tăng vào ngày cuối cùng của nhiệm kỳ chính quyền biden đã tiến hành truy tố ông với các cáo buộc gây tranh cãi,sau khi công_khai ủng_hộ donald trump vào năm 2016 ông dương được cho là đối_mặt với những áp_lực chính_trị ngày_càng gia_tăng vào ngày cuối_cùng của nhiệm_kỳ chính_quyền biden đã tiến_hành truy_tố ông với các cáo_buộc gây tranh_cãi,2025-05-15 02:09:01+00:00
Chính trị,chính xác cái đích khả thi mà quan trọng nhất là tới năm 2050 hoàn thành hệ thống tàu điện hoặc làm gì đó cho sài gòn bớt đông không còn kẹt xe thì tụi nó k lo chứng tỏ não đó là não bị thiểu năng chứ đâu phải não làm chính trị,chính_xác cái đích khả_thi mà quan_trọng nhất là tới năm 2050 hoàn_thành hệ_thống tàu_điện hoặc làm gì đó cho sài_gòn bớt đông không còn kẹt xe thì tụi nó k lo chứng_tỏ não đó là não bị thiểu_năng chứ đâu phải não làm chính_trị,2025-05-15 02:06:27+00:00
Chính trị,để hiểu pi network phải đủ kiến thức về chính trị tài chính công nghệ luật triết họcthậm chí cả tâm linh đó là lý do the simpson phán rằng pi thủ chân chính chính là thiên tài của nhân loại bẩu pi thủ sẽ đem lại siêu chủ quyền cho qg,để hiểu pi network phải đủ kiến_thức về chính_trị tài_chính công_nghệ luật triết họcthậm chí cả tâm_linh đó là lý_do the simpson phán rằng pi thủ chân_chính chính là thiên_tài của nhân_loại bẩu pi thủ sẽ đem lại siêu chủ_quyền cho qg,2025-05-15 02:02:35+00:00
Chính trị,vào khen đám chính chụy da âu châu của mày đi con chó đụ mẹ thằng nào bữa khen chính trị gia chuyên nghiệp là phải thế mà đụ mẹ ngu,vào khen đám chính chuỵ da âu châu của mày đi con chó đụ_mẹ thằng nào bữa khen chính_trị_gia chuyên_nghiệp là phải thế_mà đụ_mẹ ngu,2025-05-15 01:56:19+00:00
Chính trị,nguyễn v đài nẳm vũng chăn dắt tị nạn chính trị theo quy trình lê thanh tùng nguyễn văn đài sinh năm 1969 tại hà nội được chính phủ đức tiếp nhận tị nạn năm 2018 từ đó định cư mờ ám hơn sx hồ sơ tị nạn theo lô có mẫu sẵn có kịch bản,nguyễn_v đài nẳm vũng chăn_dắt tị_nạn chính_trị theo quy_trình lê_thanh tùng nguyễn_văn đài sinh năm 1969 tại hà_nội được chính_phủ đức tiếp_nhận tị_nạn năm 2018 từ đó định_cư mờ_ám hơn sx hồ_sơ tị_nạn theo lô có mẫu sẵn có kịch_bản,2025-05-15 01:36:30+00:00
Chính trị,trung quốc kêu gọi bình tĩnh tại biển đỏ và khôi phục đối thoại chính trị ở yemen việc giảm căng thẳng và tôn trọng thỏa thuận ngừng bắn là cần thiết để đảm bảo an toàn cho người dân và cơ sở hạ tầng cần sự hỗ trợ từ cộn,trung_quốc kêu_gọi bình_tĩnh tại biển đỏ và khôi_phục đối_thoại chính_trị ở yemen việc giảm căng_thẳng và tôn_trọng thoả_thuận ngừng_bắn là cần_thiết để đảm_bảo an_toàn cho người_dân và cơ_sở_hạ_tầng cần sự hỗ_trợ từ cộn,2025-05-15 01:15:56+00:00
Chính trị,ai cũng biết cuộc phát triển nào cũng cần có chiếu cố trọng điểm cần mục tiêu ưu tiên thay vì nhọc lòng rào đón sao họ không minh bạch hóa mọi hoạt động trước toàn dân cần nhất là cơ chế giám sát độc lập phi chính trị ở mọi mục tiêu của chính quyền,ai cũng biết cuộc phát_triển nào cũng cần có chiếu_cố trọng_điểm cần mục_tiêu ưu_tiên thay_vì nhọc_lòng rào_đón sao họ không minh_bạch hoá mọi hoạt_động trước toàn dân cần nhất là cơ_chế giám_sát độc_lập phi chính_trị ở mọi mục_tiêu của chính_quyền,2025-05-15 00:59:05+00:00
Chính trị,tất cả mọi mưu toan vượt tầm ảnh hưởng của một đảng phái chính trị đơn thuần đều là dấu chỉ của sự bất lương,tất_cả mọi mưu_toan vượt tầm ảnh_hưởng của một đảng_phái chính_trị đơn_thuần đều là dấu chỉ của sự bất_lương,2025-05-15 00:34:00+00:00
Chính trị,tập trận kiểu trung quốc chỉ sặc mùi chính trị ngoài ra chẳng có gì khác,tập_trận kiểu trung_quốc chỉ sặc_mùi chính_trị ngoài_ra chẳng có gì khác,2025-05-15 00:30:33+00:00
Chính trị,đàn ông thông minh là lấy được cô vợ biết tích lũy vàng bởi tình cảm sẽ gia tăng như vàng tài chính vững vàng như vàng lạm phát bất ổn kinh tế chính trị thì tình cảm và tài chính lại càng tăng hơn nữa,đàn_ông thông_minh là lấy được cô vợ biết tích_luỹ vàng bởi tình_cảm sẽ gia_tăng như vàng tài_chính vững_vàng như vàng lạm_phát bất_ổn kinh_tế chính_trị thì tình_cảm và tài_chính lại càng tăng hơn_nữa,2025-05-15 00:21:32+00:00
Chính trị,trợ đời sống để bán cho khách hàng đấy là lí do mĩ luôn là nước có các sản phẩm mới hỗ trợ đời sống cho nhân loại nhiều nhất trong lịch sử tuy nhiên khi các lực lượng tinh hoa chính trị mĩ đẩy lòng tham của các nhà tư bản lên cực đại cũng đồng,trợ đời_sống để bán cho khách_hàng đấy là lí_do mĩ luôn là nước có các sản_phẩm mới hỗ_trợ đời_sống cho nhân_loại nhiều nhất trong lịch_sử tuy_nhiên khi các lực_lượng tinh_hoa chính_trị mĩ đẩy lòng tham của các nhà tư_bản lên cực_đại cũng đồng,2025-05-14 23:26:10+00:00
Chính trị,chính trị nó kéo theo tất cả,chính_trị nó kéo_theo tất_cả,2025-05-14 23:22:25+00:00
Chính trị,bồn chứa tinh của đơn vị cán bộ chiến sĩ bên ngoài xòn chính trị viên thì đg đút cặc giả vào lồn sướng lồn lắm đồng dâm ơi có lần nứng sản quên khoá cửa đg nhét cặc giả vào lồn bị thằng e liên lạc mở của phát hiệnlỡ rồi nhún cặc cho nó xem luôn,bồn chứa tinh của đơn_vị cán_bộ chiến_sĩ bên ngoài xòn chính_trị_viên thì đg đút cặc giả vào lồn sướng lồn lắm đồng dâm ơi có lần nứng sản quên khoá cửa đg nhét cặc giả vào lồn bị thằng e liên_lạc mở của phát hiệnlỡ rồi nhún cặc cho nó xem luôn,2025-05-14 21:42:32+00:00
Chính trị,những chính trị gia mà đi lên từ nghèo khó thì bất cứ một ai không thể qua cái ải đồng tiền vậy hãy làm cho người dân và cử tri mỹ được biết sự thật thì mới gọi là luật pháp minh bạch,những chính_trị_gia mà đi lên từ nghèo_khó thì bất_cứ một ai không_thể qua cái ải đồng_tiền vậy hãy làm cho người_dân và cử_tri mỹ được biết sự_thật thì mới gọi_là luật_pháp minh_bạch,2025-05-14 19:49:40+00:00
Chính trị,điều gì sẽ xảy ra tiếp theo đối với quan hệ thương mại hoa kỳtrung quốc rõ ràng là các mục tiêu kinh tế và chính trị của hoa kỳ và trungquốc là không tương thích điểm này cần được nhấn mạnhquỹ đạo dài hạn của quan hệ hoa kỳtrung quốc là tiêu cực,điều gì sẽ xảy ra tiếp_theo đối_với quan_hệ thương_mại hoa kỳtrung quốc rõ_ràng là các mục_tiêu kinh_tế và chính_trị của hoa_kỳ và trungquốc là không tương_thích điểm này cần được nhấn mạnhquỹ đạo dài_hạn của quan_hệ hoa kỳtrung quốc là tiêu_cực,2025-05-14 19:26:21+00:00
Chính trị,có hiểu báo nói không vậy bây giờ các nhà đầu tư không công khai minh bạch thì người thiệt là dân bộ chính trị làm vậy là đúng rồi,có hiểu báo nói không vậy bây_giờ các nhà_đầu_tư không công_khai minh_bạch thì người thiệt là dân bộ_chính_trị làm_vậy là đúng rồi,2025-05-14 17:20:18+00:00
Chính trị,không một ai có thể lý luận chính trị vừa đơn giản dễ hiểu vừa trình độ cao như bác hồ luôn tư tưởng của bác vượt thời đại lắm càng đọc càng ngưỡng mộ,không một ai có_thể lý_luận chính_trị vừa đơn_giản dễ hiểu vừa trình_độ cao như bác_hồ luôn tư_tưởng của bác vượt thời_đại lắm càng đọc càng ngưỡng_mộ,2025-05-14 17:13:51+00:00
Chính trị,đây là chính trị đó đáng lắm ai nói gì trái chiều về chính quyền hoặc bác chúng nó là mặc định gt địt đéo ba sọc phản động bala cho đến khi bị tát vỡ mồm bởi tình yêu của chúng,đây là chính_trị đó đáng lắm ai nói gì trái chiều về chính_quyền hoặc bác chúng_nó là mặc_định gt địt đéo ba sọc phản_động bala cho đến khi bị tát vỡ mồm bởi tình_yêu của chúng,2025-05-14 16:52:11+00:00
Chính trị,check out thời sự amp chính trịs video tiktok,check out thời_sự amp chính trịs video tiktok,2025-05-14 16:42:26+00:00
Chính trị,trump gỡ cấm vận syria bước tiến hòa bình trung đông trump bất ngờ xóa bỏ lệnh trừng phạt syria ngay sau đó chốt deal 600 tỷ usd với saudi chính trị amp tiền bạc luôn song hành bạn nghĩ bước này đổi chác ra sao trump syria news tintuc viral,trump gỡ cấm_vận syria bước_tiến hoà_bình trung đông trump bất_ngờ xoá_bỏ lệnh trừng_phạt syria ngay sau đó chốt deal 600 tỷ usd với saudi chính_trị amp tiền_bạc luôn song_hành bạn nghĩ bước này đổi_chác ra sao trump syria news tintuc viral,2025-05-14 16:30:01+00:00
Chính trị,xây dựng tương lai chính trị đổi mới và cải cách toàn diện qua,xây_dựng tương_lai chính_trị đổi_mới và cải_cách toàn_diện qua,2025-05-14 16:12:37+00:00
Chính trị,mỹ ko viện trợ thì 1 lũ ngu dốt ăn tàn phá hại thua tan tác đu càng qua mỹ ở đợ làm chó trông nhà cho mẽo mà tư cách con cặc gì bàn luận kinh tế chính trị ở đây hả lũ súc vật1 mình tao chấp cả lũ mỹ nô tông môn họ hàng lũ chó tụi mày vào đây phản biện,mỹ ko viện_trợ thì 1 lũ ngu_dốt ăn_tàn_phá_hại thua tan_tác đu càng qua mỹ ở_đợ làm chó trông nhà cho mẽo mà tư_cách con cặc gì bàn_luận kinh_tế chính_trị ở đây hả lũ súc vật1 mình tao chấp cả lũ mỹ nô tông_môn họ_hàng lũ chó tụi mày vào đây phản_biện,2025-05-14 16:00:20+00:00
Chính trị,câu lạc bộ khoa học xã hội giúp bạn tìm hiểu về các vấn đề xã hội kinh tế và chính trị đồng thời phát triển tư duy phản biện,câu_lạc_bộ khoa_học_xã_hội giúp bạn tìm_hiểu về các vấn_đề xã_hội kinh_tế và chính_trị đồng_thời phát_triển tư_duy phản_biện,2025-05-14 15:40:41+00:00
Chính trị,dự án bitcoin mang họ trump bước ngoặt chính trị hóa ngành khai thác tiền số tại mỹ bitcoin finlaunch crypto news,dự_án bitcoin mang họ trump bước_ngoặt chính_trị_hoá ngành khai_thác tiền số tại mỹ bitcoin finlaunch crypto news,2025-05-14 15:30:43+00:00
Chính trị,ngày 45nhiều người đã biểu tình trước đsq vn tại londontrong dịp vnkỷ niệm 50 năm giải phóng miền namngười biểu tình kêu gọi vn trả tự do cho các tù nhân lương tâmmở rộng dân chủ tôn trọng nhân quyền và các quyền chính trị của người dân,ngày 45nhiều người đã biểu_tình trước đsq vn tại londontrong dịp vnkỷ niệm 50 năm giải_phóng miền namngười biểu_tình kêu_gọi vn trả tự_do cho các tù_nhân lương tâmmở rộng dân_chủ tôn_trọng nhân_quyền và các quyền chính_trị của người dân,2025-05-14 15:25:14+00:00
Chính trị,bí mật tham nhũng trong chính trị vụ án nguyễn anh tuấn và quyền lực ngầm qua,bí_mật tham_nhũng trong chính_trị vụ án nguyễn_anh_tuấn và quyền_lực ngầm qua,2025-05-14 15:00:40+00:00
Chính trị,donald trump hiện nay là một cơn ác mộng của cái đám cánh tả vì chẳng có một ai có thể đoán trước ông ta sẽ làm gì và những gì ông ta làm thường thì chính trị gia không dám nghĩ tới,donald trump hiện_nay là một cơn ác_mộng của cái đám cánh tả vì chẳng có một ai có_thể đoán trước ông ta sẽ làm gì và những gì ông ta làm thường thì chính_trị_gia không dám nghĩ tới,2025-05-14 14:07:13+00:00
đạo đức,điểm uy tín cũng giống như tài khoản tiết kiệm đạo đức,điểm uy_tín cũng giống như tài_khoản tiết_kiệm đạo_đức,2025-05-15 08:33:07+00:00
đạo đức,một cộng đồng mạnh phải có nền tảng đạo đức vững vàng,một cộng_đồng mạnh phải có nền_tảng đạo_đức vững_vàng,2025-05-15 08:33:01+00:00
đạo đức,mỗi người dùng đều là một nút trong mạng lưới đạo đức,mỗi người dùng đều là một nút trong mạng_lưới đạo_đức,2025-05-15 08:32:51+00:00
đạo đức,không chỉ là dữ liệu là giá trị đạo đức số hóa,không_chỉ là dữ_liệu là giá_trị đạo_đức số_hoá,2025-05-15 08:21:49+00:00
đạo đức,dự án khiến mình quan tâm hơn đến đạo đức kỹ thuật số,dự_án khiến mình quan_tâm hơn đến đạo_đức kỹ_thuật_số,2025-05-15 08:21:28+00:00
đạo đức,lại có những phát ngôn kém văn hóa xúc phạm người khác xâm hại đạo đức xã hội bất chấp nhân quả,lại có những phát_ngôn kém văn_hoá xúc_phạm người khác xâm_hại đạo_đức xã_hội bất_chấp nhân_quả,2025-05-15 08:17:49+00:00
đạo đức,mấy đứa lfc này khéo biết thừa mà vẫn bao che cho con giặc này á đcm bênh con tiểu tam chằm chặp thì đúng hiểu tư duy đạo đức chúng nó như nào luôn vật họp theo loài,mấy đứa lfc này khéo biết thừa mà vẫn bao_che cho con giặc này á đcm bênh con tiểu tam chằm_chặp thì đúng hiểu tư_duy đạo_đức chúng_nó như nào luôn vật họp theo loài,2025-05-15 08:15:41+00:00
đạo đức,dự án này chính là hộ chiếu đạo đức cho người dùng web3,dự_án này chính là hộ_chiếu đạo_đức cho người dùng web3,2025-05-15 08:11:55+00:00
đạo đức,chúng ta đang bước vào thời đại của đạo đức số,chúng_ta đang bước vào thời_đại của đạo_đức số,2025-05-15 08:08:08+00:00
đạo đức,đây là thước đo đạo đức kỹ thuật số đầu tiên mình thấy,đây là thước_đo đạo_đức kỹ_thuật_số đầu_tiên mình thấy,2025-05-15 08:02:41+00:00
đạo đức,cộng đồng có đạo đức là nhờ vào công cụ như thế này,cộng_đồng có đạo_đức là nhờ vào công_cụ như thế_này,2025-05-15 07:50:24+00:00
đạo đức,một dạng chứng chỉ đạo đức số cho thế giới web3,một dạng chứng_chỉ đạo_đức số cho thế_giới web3,2025-05-15 07:50:18+00:00
đạo đức,web3 giờ không chỉ phi tập trung mà còn phải có đạo đức,web3 giờ không_chỉ phi tập_trung mà_còn phải có đạo_đức,2025-05-15 07:49:54+00:00
đạo đức,giverep giúp nâng chuẩn mực đạo đức kỹ thuật số,giverep giúp nâng chuẩn_mực đạo_đức kỹ_thuật_số,2025-05-15 06:53:36+00:00
đạo đức,một nền tảng đạo đức trong thế giới kỹ thuật số,một nền_tảng đạo_đức trong thế_giới kỹ_thuật_số,2025-05-15 06:36:01+00:00
đạo đức,xin chào bài phát biểu này chỉ trích lãnh đạo eu có thể nhắm đến ursula von der leyen về các giao dịch hậu trường và đạo đức giả kỹ trị cho rằng điều này khiến châu âu trở nên ngột ngạt và xa rời dân chúng nội dung chính gồm lãnh,xin chào bài phát_biểu này chỉ_trích lãnh_đạo eu có_thể nhắm đến ursula von der leyen về các giao_dịch hậu_trường và đạo_đức giả kỹ trị cho rằng điều này khiến châu_âu trở_nên ngột_ngạt và xa_rời dân_chúng nội_dung chính gồm lãnh,2025-05-15 06:29:05+00:00
đạo đức,giverep đưa giá trị đạo đức vào blockchain,giverep đưa giá_trị đạo_đức vào blockchain,2025-05-15 06:26:54+00:00
đạo đức,trước chỉ có lai mỹ sau 75 đến giờ có lai gì tàu đài loan hàn quốc châu âu châu phi đủ hết đụ má mày ăn cứt tàu riết lú hay sao mà mở miệng nói ra cứt ko vậy người miền nam đéo cần mày xót đạo đức giả yêu nước mõm hả,trước chỉ có lai mỹ sau 75 đến giờ có lai gì tàu đài_loan hàn_quốc châu_âu châu_phi đủ hết đụ má mày ăn cứt tàu riết lú hay sao mà mở_miệng nói ra cứt ko vậy người miền nam đéo cần mày xót đạo_đức giả yêu nước mõm hả,2025-05-15 04:53:15+00:00
đạo đức,trước nhỏ bạn t cho t xem cái clip này thấy lôi sư nó cười tỏa nắng lung linh rạng ngời vl t tưởng nó hiền hiền kiểu hiền trưởng thành xong xem phim thì t mới biết nó bị tâm thần đạo đức,trước nhỏ bạn t cho t xem cái clip này thấy lôi sư nó cười toả nắng lung_linh rạng ngời vl t tưởng nó hiền hiền kiểu hiền trưởng_thành xong xem phim thì t mới biết nó bị tâm_thần đạo_đức,2025-05-15 04:11:27+00:00
đạo đức,ok nói cũng k sai vì mọi thứ nằm ở vấn đề đạo đức mà hy vọng sau này lỡ idol chúng m có bị tương tự cũng đừng đi bán thảm bị bạo lực lạnh nơi đất khách nhé,ok nói cũng k sai vì mọi thứ nằm ở vấn_đề đạo_đức mà hy_vọng sau_này lỡ idol chúng m có bị tương_tự cũng đừng đi bán thảm bị bạo_lực lạnh nơi đất khách nhé,2025-05-15 03:55:06+00:00
đạo đức,học thuyết khổng giáo ảnh hưởng sâu sắc đến văn hóa việt nam từ cách ứng xử quan hệ gia đình đến các giá trị đạo đức truyền thống cũng chính vì vậy mà chúng ta thấy được nhiều nét đẹp văn hóa việt có nguồn gốc từ khổng,học_thuyết khổng giáo ảnh_hưởng sâu_sắc đến văn_hoá việt_nam từ cách ứng_xử quan_hệ gia_đình đến các giá_trị đạo_đức truyền_thống cũng chính vì_vậy mà chúng_ta thấy được nhiều nét đẹp văn_hoá việt có nguồn_gốc từ khổng,2025-05-15 03:53:03+00:00
đạo đức,rãnh rủ mấy con vợ bé đi học luôn lớp dạy về đạo đức chung đi chứ có tiền mà ngu quá,rãnh rủ mấy con vợ_bé đi học luôn lớp dạy về đạo_đức chung đi chứ có tiền mà ngu quá,2025-05-15 02:47:57+00:00
đạo đức,bố cái thằng hề zelenskykyky chó điên chó hoang bọn ukraina là những kẻ vô ơn ăn cháo đá bát vô đạo đức mất nhân tính quên đi nguồn gốc quên đi cha ông của bọn chúng là ai chúng đạp vào mặt cha ông của bọn chúng thì đều không đáng sống,bố cái thằng hề zelenskykyky chó điên chó hoang bọn ukraina là những kẻ vô_ơn ăn_cháo_đá_bát vô đạo_đức mất nhân_tính quên đi nguồn_gốc quên đi cha_ông của bọn chúng là ai chúng đạp vào mặt cha_ông của bọn chúng thì đều không đáng sống,2025-05-15 02:47:32+00:00
đạo đức,có ai như bầy đàn trục ma quỷ hoa kỳnato không chúng là những tên chùm khủng bố chùm chộm cướp chùm lật lọng chùm vu khống chùm ăn vạ chùm khốn nạn chùm mất dạy chùm vô liêm sỉ chùm vô đạo đức chùm mất nhân tính là bầy đàn hoa kỳnato,có ai như bầy đàn trục ma_quỷ hoa kỳnato không chúng là những tên chùm khủng_bố chùm chộm cướp chùm lật_lọng chùm vu_khống chùm ăn_vạ chùm khốn_nạn chùm mất_dạy chùm vô_liêm_sỉ chùm vô đạo_đức chùm mất nhân_tính là bầy đàn hoa kỳnato,2025-05-15 02:39:48+00:00
đạo đức,ngu hơn heo chống mỹ lol đi xâm lược miền nam quỳ lạy thằng tàu mà còn nói đạo đức làm nô lệ cho cộng tưởng mình tự do làm thêm mấy cái cải cách ruông đất nữa dọn thêm 170 ngàn thằng bắc kỳ đi,ngu hơn heo chống mỹ lol đi xâm_lược miền nam quỳ lạy thằng tàu mà_còn nói đạo_đức làm nô_lệ cho cộng tưởng mình tự_do làm thêm mấy cái cải_cách ruông đất nữa dọn thêm 170 ngàn thằng bắc kỳ đi,2025-05-15 01:46:44+00:00
